publishedAt,authorDisplayName,textDisplay,like_count,likeCount
2024-05-14T02:08:25Z,@sarifudin2135,Buktikan,,0.0
2024-05-14T02:00:13Z,@rusmanahmad4981,"Anda itu dipilih oleh rakyat, jadi minta dukung dari rakyat,bukan mantan persiden,",,0.0
2024-05-14T01:44:19Z,@yudiastuti2171,Ya ya ya..ditunggu ya pak..janji2mu..jgn asbun,,0.0
2024-05-14T01:35:29Z,@subariahjogja3107,"Mulai banyak omong juga Prabowo ini, sudahlah jangan terlalu banyak omong Ndak malah keseleo lidah",,0.0
2024-05-14T01:32:39Z,@nineseven537,"Arogan sekali bapak ini, mulai nampak wajah aslinya.. skrg udh gk gemoy yaaa",,0.0
2024-05-14T01:31:18Z,@NyobaKreatif,Indonesia BERDIKARI,,0.0
2024-05-14T01:18:38Z,@ettyjumiaty1886,"klw sy peribadi malu jd peresidain krn curang,walaupun dimenangkan krn udh sekongkol.",,0.0
2024-05-14T01:20:14Z,@tugasnitizen,Junjunganmu dh turun pangkat ngejar jabatan jdi gubernur DKI....mending lu julatin,,0.0
2024-05-14T01:18:29Z,@user-tv5ys1jr3x,Mantap di tunggu kerja nyatanya pak,,0.0
2024-05-14T01:12:45Z,@salamahaw8185,ini manusia yg haus kekuasa an jadi g bisa nahan mulutnya dasar si pelanggar segalanya wo mulut itu jaga kamu menangnya g bersih,,0.0
2024-05-14T01:07:08Z,@MuhammadSaw-z,Makin gila kegoblokan mereka terang2an bangga dengan nepotisme,,0.0
2024-05-14T01:05:29Z,@animepositif7317,"Ayuk Pak,indonesia memang bth sosok pemimpin yg keras,perbaiki  kepolisian atau tni yg ga bener,berantas opm,lawan DPR yg seenak jidat buang2 anggaran...",,0.0
2024-05-14T01:04:19Z,@user-li2yb3rv9w,"Ibarat orang hanyut di sungai, rumputpun jadi pegangan",,0.0
2024-05-14T01:04:16Z,@alambugisbelawa5100,Yang penting presideng yg mendukung bapak mempunyai ijazah asli bukan ijazah aspal,,0.0
2024-05-14T00:54:30Z,@winarnoarno3575,ya nggak ngapa2in pak cuma mau liat ajaaah... sama ikut joget2 ajah😅😅😅,,0.0
2024-05-14T00:48:12Z,@lalawijaya168,Cmn omon omon doang.... Persiapan korupsi berjamaah 😂,,0.0
2024-05-14T00:46:21Z,@user-zu8ss4jd4p,seratus prcen pk bowo mantap se x,,0.0
2024-05-14T00:40:08Z,@muswandi6128,Yg menelu elukn si wowo coba liat nanti ending bya,,0.0
2024-05-14T00:38:30Z,@muswandi6128,Buktikan klu bsa jngn omon omon  doangan,,0.0
2024-05-14T00:25:50Z,@umahaju2735,Indonesia cemas,,0.0
2024-05-14T00:13:04Z,@afandi0365,Omon omon,,0.0
2024-05-14T00:12:52Z,@olansolihunhadi3340,pak prabowo semakin kesini semakin arif semakin bijaksana semakin kelihatan orang yg sangat jujur terbuka dan sangat tulus hatinya di dalam mencintai nkri ini. ❤❤❤❤❤❤,,3.0
2024-05-14T01:06:09Z,@user-li2yb3rv9w,"Yang mengkhawatirkan orang disekitarnya, termasuk wapres nya juga",,1.0
2024-05-14T00:08:45Z,@MbahKung-zq6ni,Nah lo ngaku sendiri tu kan 😢😢😢😢,,0.0
2024-05-13T23:59:31Z,@user-iv9te8um8r,Waktu akan menjawab apakah indonesia akan berdiri di kaki sendiri?seperti omongan prabowo,,0.0
2024-05-13T23:56:29Z,@bergas975,"Krn keturunn jawa selatan, salah satu karakternya blak2an, yg penting jgn omon2",,0.0
2024-05-13T23:53:28Z,@shonhaj3312,Sombong amat  🤣🤣🤣,,0.0
2024-05-13T23:43:59Z,@suwardi6102,"Klo emang berani segera bahas uu perampasan,pemiskinan koruptor,,,kok malah yg didengungkan makan gratis itu cuma buat ajang korupsi",,0.0
2024-05-13T23:30:06Z,@salsabilasukaryo1056,Sdh kelihatan aslinya😂😂,,0.0
2024-05-13T23:28:41Z,@sholehkhant1182,Kenapa bukan DUKUNGAN dari RAKYAT yg NT BANGGAKAN ...,,0.0
2024-05-13T23:27:36Z,@YaniMr.-qv2ik,Ingat  sebelum di dukung namanya  beda ...setelah di dukung nama ganti ...macam  mana . Pagi  tahu . Siang tempe . Ehhh malam nya ber ubah .ONCOM.. tetap aja .awal nya kacang dele...,,1.0
2024-05-13T23:16:03Z,@badd1234,LAH BAPA DI PUTUSKAN DI MK .BAHWA PA PERSIDEN TIDAK TERLIBAT .😅😂 CUMAN LOGIKA RAKYAT CERDAS MASA BAPA GA DUKUNG ANAK .SELAMAT BEKERJA PA .JANJI BAPA 1 YG DI KENANG KASIH MAKAN GERATIS ANAK SEKOLAH🎉,,0.0
2024-05-13T23:15:25Z,@iistrisnawati3412,Wowo wowo. Kasian wooooo,,0.0
2024-05-13T23:07:04Z,@user-cl9bp3dv8e,Ya pantesan curang,,0.0
2024-05-13T23:06:22Z,@herisupriyanto8930,Bravo presidenku,,0.0
2024-05-13T23:02:57Z,@sampoernasampun8877,Kok kayak gini pak belum apa 2 udah mulai kelihatan,,0.0
2024-05-13T22:59:31Z,@masenuk1039,Mulai menunjukkan gaya keras?,,0.0
2024-05-13T22:43:22Z,@fakriadiadi1536,Nasi gratisnya gimana boy,,0.0
2024-05-13T22:42:45Z,@fakriadiadi1536,Alaaah....ngga ada ide sendiri sisisa orba,,0.0
2024-05-13T22:39:50Z,@user-iy8ss1sy7l,Maju pak de,,0.0
2024-05-13T22:38:00Z,@calonjenazah1013,"Andai saja pak Prabowo bisa seperti pak Soeharto,begal penjahat pencuri dan koruptor di basmi.",,0.0
2024-05-13T22:31:32Z,@burhanelon8194,Gimana ibu negara nya kapan di tetapkan?,,0.0
2024-05-13T22:30:49Z,@yaqineno3169,"Jangan besar hati PK, belum kerja,😂😂😂😂😂😂😂😂😂 nanti cawe cawe",,0.0
2024-05-13T22:25:30Z,@novralwijaya2778,wkwkwkwk,,0.0
2024-05-13T22:24:43Z,@user-yx7tw5lq9v,lucu deh 😂😂😂😂😂😂😂😂,,0.0
2024-05-13T22:23:04Z,@faizah7297,"kalau ksatria percaya diri ..cukup dukungan rakyat aja....bro. nggak perlu bangga didukung presiden2 gagal sebelumnya.....katanya menang pemilu,..kok masih nggak PD...omon omon tak bisa tipu hati...",,0.0
2024-05-13T22:06:09Z,@newcartoon991,Anda pikir pemerintahan anda akan barokah?<br>sepertinya tidak,,0.0
2024-05-13T21:31:43Z,@mbahkelik6762,penjilat,,0.0
2024-05-13T21:16:40Z,@RedoSono,"Arogan banget,belum dilantik sudah omon omon dukungan.tunjukkan kerja dan janji yg di ucapkan.rakyat nunggu hasilnya.negara punya rakyat...",,0.0
2024-05-13T21:10:38Z,@selamatkbsaragih7863,😂😂😂😂....<br>Omong kosong,,0.0
2024-05-13T21:09:18Z,@HardyHardiman-iv8pn,Ngomong opo to woooo kowe ki ????,,0.0
2024-05-13T21:01:18Z,@user-mb3iv7ij2t,Ymg membantu nggk mengakui. Yng di bantu membuka aiibnya sendiri. Berarti kalau nggk di bantu nggk kepilih lg.. Wkwkwk,,0.0
2024-05-13T20:57:55Z,@user-mb3iv7ij2t,Omongan calon pemimpin spt ini nyakiti hati rakyat. Di bantu cara nggk bener bangga. Ya Tuhanku selamatkan negri ini. Smin.,,0.0
2024-05-13T20:48:49Z,@umiyasih2081,Blm dilantik...sudah terjadi kesejahteraan rakyat turun drastis terutama uang kuliah...,,0.0
2024-05-13T20:46:14Z,@RudiWidianto-cf3jr,<b>BISA NYA CUMA OMON OMON OMON ..</b> 😅😂🤣,,0.0
2024-05-13T20:32:49Z,@oktafortalisa2857,Orang yg sungguh punya komitmen dan punya prinsip....SALLLUUUTTT..!,,0.0
2024-05-13T20:22:06Z,@cintakayla7583,Gimana lo aja woo...yg penting indonesia dan rakyat nya selamat,,0.0
2024-05-13T19:55:10Z,@jKubilaikhan,OGAH BANGET DI PIMPIN. OLEH PENCULIK PEMBUNUH YANG JALAN SUDAH PINCANG KARENA STROKE  SUDAH 2X  😂😂😂😂,,1.0
2024-05-13T19:45:38Z,@SaelahUmar-mi9gv,Mau apa..? angkat ajah derajat timses 2019... PT sy bangkrut. Sampai sekarang..,,0.0
2024-05-13T19:43:29Z,@tamantunishandhiono647,Benar kata Gus Dur orang yg paling ikhlas adalah Prabowo . Salut pada Bapak ...,,2.0
2024-05-13T19:05:23Z,@bowo1551,Buktikan jgn omon2,,0.0
2024-05-13T18:33:26Z,@MFTHYN,Negara kita gak bakalan maju<br>kalau kalau masih penakut tidak mau bertindak pada yng bersalah,,0.0
2024-05-13T18:23:44Z,@user-fl3bk2tn8i,"Pak pres,Koruptor tembak mati pak",,0.0
2024-05-13T18:15:03Z,@OppoA3s-bz1rd,"Nasip...nasip....nasip...bangsaku , negaraku Indonesia.....",,0.0
2024-05-13T18:10:14Z,@OppoA3s-bz1rd,"Orang tidak butuh bicara bayak,,,  karna bicara itu cuma menghasilkan TEPOK tangan saja....",,0.0
2024-05-13T18:09:46Z,@jedidazuri8817,TANDAI .. TANDAI ..SAYA YAKIN .. OTORITER WONG IKI,,0.0
2024-05-13T18:00:32Z,@dutadavadeva3831,Joko Widodo bisa kerja... Prabowo bisa nonton orang kerja 😂,,0.0
2024-05-13T17:59:33Z,@olgaalhamra6211,omon omon truss,,0.0
2024-05-13T17:55:32Z,@omtotot,Macan kehilangan taring 🤣🤣,,0.0
2024-05-13T17:42:20Z,@tazmanian9555,Mbèlgedes.....,,0.0
2024-05-13T17:38:35Z,@NanoGusmara-ro5et,benar pk prabowo bapak harus kuwat harus cerdas harus adil harus jujur demi memajukan bangsa ini biar negara lebih maju lebih kuwat lebih makmur saya pesan sama pk prabowo sekolah bangsa ini harus dibebaskan dari pembayaran apun itu biar anak&quot; kita lebih cerdas dan kuwat,,0.0
2024-05-13T17:38:05Z,@PutraArya-uv1ui,Didukung siapa pun gak bakal ngaruh apapun bagi masyarakat <br>Yg bikin pengaruh itu <br>Merealisasikan janji yg sudah bapa buat<br>Terutama kesejahteraan rakyat <br>Sama hukum koruptor tolong di perberat pak bila perlu hukum mati,,0.0
2024-05-13T17:06:32Z,@sunarponarpo200,"RAKYAT MENANTI SUSU GRATIS DAN MAKAN GRATIS , JANGAN  OMON OMON",,0.0
2024-05-13T17:01:22Z,@sunarponarpo200,JUJUR KAMI BELUM TAHU DARI MANA RUMUSNYA P PRABOWO  DI PILIH RAKYAT 50 %. OMON OMON AH,,0.0
2024-05-13T16:58:28Z,@Penghobi07,"Pasti donk pak harto dukung pak prabowo...kan pak harto idola kami..<br><br>Tolong pak, premanisme, begal, harga pangan dan pakan, bbm dikembalikan seperti zamannya pak harto",,0.0
2024-05-13T16:57:42Z,@sunarponarpo200,"Jangan joget joget dulu dan jangan janji janji dulu buktikan  kerjamu untuk rakyat ,",,0.0
2024-05-13T16:53:27Z,@sunarponarpo200,Dukungan penjilat,,0.0
2024-05-13T16:52:40Z,@sunarponarpo200,Pedukung pemeras  dan koruptor,,0.0
2024-05-13T16:41:43Z,@Yokoubus,❤❤❤❤❤,,0.0
2024-05-13T16:41:19Z,@Yokoubus,❤❤❤❤,,0.0
2024-05-13T16:40:59Z,@Yokoubus,❤❤❤❤❤❤,,0.0
2024-05-13T16:38:33Z,@ghhhyrrayaga5668,Mantab jujurndan terbuka !,,0.0
2024-05-13T16:26:19Z,@Anwar-vh2vv,Per caya Diri aja pak.kan 58%,,0.0
2024-05-13T16:23:07Z,@supikuswatibu9934,Rakyat Indonesia nunggu kerja Bpk. Tuk menyejahterakan rakyatnya,,0.0
2024-05-13T16:10:39Z,@yulipurwanto9960,Mantapp aslinya kelihatan👍👍👍,,0.0
2024-05-13T15:50:26Z,@idasidabutar108,"Yaah kalau dukung beneran, minta dong kenaikan Bbm saat ini 😀😅seperti yg di minta pak Lurah sama pendahulunya. Minyak dunia naik lho..kalau di subsidi maka hutang akan semakin bengkak. Nanti progran makan siang gretongan nggak ada 😂",,0.0
2024-05-13T15:49:25Z,@user-uk4gw4rr6r,Pengen nengok mimik muka Megawati yg selama ini mencekik rakyat,,0.0
2024-05-13T15:39:31Z,@rayzanharyarizky5708,Buktikan kalau kau seorang pejuang... Ngomong donk yg di bnyak kan.. Duh gak bnget,,1.0
2024-05-13T15:38:02Z,@rayzanharyarizky5708,Wkwkwkw.. Wkwkkwkwkwkw.. Lucu lucu,,1.0
2024-05-13T15:27:02Z,@tajuddintajud5533,Klo gk didukung jkwi anda gk bakal dpt 58 % wo..l,,0.0
2024-05-13T15:21:54Z,@sugihrussugihrus1491,Jgn hanya omon-omon,,0.0
2024-05-13T15:20:54Z,@Nyorocosdewe,Siap2 nunggu makan gratis,,0.0
2024-05-13T15:17:32Z,@Owl.Fpv_JFF,Hopeless,,0.0
2024-05-13T15:16:39Z,@user-ur3li1sq3z,Manusia GK abadi bos,,0.0
2024-05-13T15:11:19Z,@muhamadtaufik7521,Tapi siapapun persidenya sebaik apapun persidenya .kl ga kuat ga teguh pendirian  tantanganya beraat .,,0.0
2024-05-13T15:06:54Z,@novakembuan3319,Respect buat bp Prabowo 🙏🙏🇮🇩🇮🇩,,0.0
2024-05-13T14:56:52Z,@rohminfa6075,"Keren pak..memang saat inilah waktu yg tepat,bkn 2014 bkn 2019 tp 2024..semakin matang",,0.0
2024-05-13T14:55:13Z,@aronilaia1847,mantap,,0.0
2024-05-13T14:54:22Z,@user-rd1wi9fh6y,Oke lah pak. Semoga kedepan bisa membawa indonesia menjadi lebih baik. Hentikan tangisan anak bangsa yg susah mencari pekerjaan,,0.0
2024-05-13T14:53:27Z,@windariana9828,Luar biasa pak Prabowo yess,,0.0
2024-05-13T14:53:18Z,@aronilaia1847,mantap prabowo,,0.0
2024-05-13T14:53:06Z,@eyangretno284,O2  tidak pantas RI.I  tidak berprestasi  minim pendidikanya  rekam jejak hitam. MEMALUKAN indonesia.,,0.0
2024-05-13T14:48:09Z,@kurniawankurniawan7254,Pak ko gitu pidatong,,0.0
2024-05-13T14:44:33Z,@suaeptantawi6902,KERJA NYATA JANGAN OMONG DOANG,,0.0
2024-05-13T14:44:05Z,@susenoseno3148,Ingat anda ketutunan china bapak mu pernah mengjianati bangsa RI,,0.0
2024-05-13T14:43:05Z,@susenoseno3148,Di dukung oleh tokoh koruptor dari partai perampok,,0.0
2024-05-13T14:36:08Z,@weidoop5327,Proxy server China baru pngganti mukidi si boneka unyu,,0.0
2024-05-13T14:33:41Z,@rusliruslicokro9878,Tak ada berada tempua bersarang rendah mendukung ada maksud,,0.0
2024-05-13T14:20:03Z,@fabrisoniceilyas2136,Aku bangga sama bpk ...orangnya jujur❤,,0.0
2024-05-13T14:14:01Z,@user-wz6bt4hv2u,Betuuul kiyai gusdur itu waly apa yg diucpkn psti bnr,,0.0
2024-05-13T14:02:45Z,@SudarmonoDanu,"Buktikan jalankan dulu programu makan susu gratis, jgn banyak bicara jgn bangga dulu",,0.0
2024-05-13T13:26:27Z,@ahm2dhusa3ni66,Mantap. Humoris tegas ga basa basi,,0.0
2024-05-13T13:20:50Z,@dediapriyanto6180,"Tolong pak prabowo, itu pahlawan devisa di kurangin, ksihan banyak anak kecel jadi korban percerayan orang tua nya",,0.0
2024-05-13T13:20:12Z,@supri4759,Angka 13 di mana mana anggka sial lihat aja kalo nggak<br> percaya,,0.0
2024-05-13T13:19:29Z,@CinWijaya-pk7gw,GENTLEMAN<br><br><br><br>❤❤❤❤❤❤❤❤❤❤,,0.0
2024-05-13T13:09:47Z,@user-cp5ei6ls6y,"Pak Prabowo seperti aku hitungannya kaya  aku mau masang togel Singapura,hahahahahaha. Biar tambah cerdas pemikiran supaya nanti ga lupa dg program nya makan siang gratis biar tambah cerdas rakyatnya, amin yarobal alamin.",,0.0
2024-05-13T13:09:07Z,@ibnu.rachmat,"trus aku harus bilang WOW, gitu?",,0.0
2024-05-13T13:09:07Z,@wimfi,Banyak omon,,0.0
2024-05-13T13:07:03Z,@sumirantoke-mh4pq,boktikan sama rakyat kerjamu jangan ngomong melulu.,,0.0
2024-05-13T13:03:55Z,@lukassimanjuntak211,Ganjal ganjal ganjal to ganjal to,,0.0
2024-05-13T13:01:44Z,@DarwisTaripar,Sama&quot; penghianat yg mndukung yg lahir nanti jadi apa coba?,,0.0
2024-05-13T12:56:35Z,@user-xh4be3qe7l,🤡🤡🤡🤡🤡🤡🤡🤡🤡🤡,,0.0
2024-05-13T12:48:51Z,@hensihombing6733,Mantap bah ... Suatu pengakuan yg   sgt sederhana,,0.0
2024-05-13T12:28:26Z,@user-ut9on2ui3p,Lanjutkan hati hati hati orang siapa ngerti👍 lanjutkan.,,0.0
2024-05-13T12:16:52Z,@kanjengdoso7713,Merasa bangga dan akhirnya berujung kesombongan pdhl dr hasil kecurangan,,0.0
2024-05-13T12:10:18Z,@jojo-tw7tk,Mantap pak prabowo...jangn dengarkan pendukung bapak yg palsu.baru ada yg muda dikit lnagsung berpaling dari pak prabowo tapi mereka kalah dan sekrng giliran mereka yg sakit hati😂,,0.0
2024-05-13T11:46:55Z,@asephernawan426,Mantap pak..<br>Sya coblos bpak waktu pemilu.,,0.0
2024-05-13T11:45:42Z,@sutjiptong7277,Tugas pertama pak babat habis koruptor dl tunjukan powermu wkkwkwwk,,0.0
2024-05-13T11:43:19Z,@nfkart9983,Ya sudah pas....maling ngumpul,,0.0
2024-05-13T11:39:25Z,@kamalli3484,Mantaaap presidentku,,0.0
2024-05-13T11:15:18Z,@fathiasyawie4436,Tapi jalan 4 tahun kedepannya <br>Gibran jadi lawan <br>Maka sehat selalu pak Prabowo Subianto ya,,0.0
2024-05-13T11:06:38Z,@user-bm1sj7ex1w,"Yang mendukung rakyat bos,bukan jokwi😂",,0.0
2024-05-13T10:56:13Z,@marhan2761,"Jangan kebanyakan omon2 pak,  Kalo ga ada bukti nyata ga usah koar2..... Sejahterakan Rakyat, bukan partai sama keluarga elo",,0.0
2024-05-13T10:22:21Z,@enisimin9498,❤❤❤❤💪💪💪👍👍👍🤲🤲🤲,,0.0
2024-05-13T10:13:46Z,@user-ro3nx6sv8v,Preeeettttt,,0.0
2024-05-13T09:45:42Z,@lidaayu6032,Tgl 14 pemilu tgl 13 udah di umumin.,,0.0
2024-05-13T09:34:23Z,@halostm1730,omon omon joget joget,,0.0
2024-05-13T09:25:35Z,@MuhammadMulyono-iw1ly,👎,,0.0
2024-05-13T09:14:44Z,@nasiib3890,pemilu balas budi ... <br>saling mencuranggi,,0.0
2024-05-13T08:59:35Z,@user-to1sb7em5q,Mantap Pak Prabowo .kam8 setia mendukung anda ..siip  lah .,,0.0
2024-05-13T08:59:25Z,@zianzafa2293,Ingat PK Bowo.. rakyat kecil hanya ingin.. BBM murah harga kebutuhan pokok murah serta pajak semurah murahnya.. meskipun kami TDK d ksh makan gratis.. ataupun bansos..,,0.0
2024-05-13T08:33:33Z,@albertusaswin2012,"Mengingat segala drama yang terjadi dan tanggung jawab di balik tugas, padahal selama ini belum tampak bukti kinerjanya, saya nggak merasa bangga.",,0.0
2024-05-13T08:17:47Z,@prost984,"Lanjutkan pak prabowo,cuma pak Prabowo yg salah satunya tidak melupakan sejarah bangsa Indonesia ...",,0.0
2024-05-13T08:10:32Z,@c_martinjuniorpandapotan2554,Terus gimana?..,,0.0
2024-05-13T08:08:41Z,@MataniMath,Itu tanda Konoha jadi negeri celaka di bawah anda,,0.0
2024-05-13T08:06:40Z,@akangali5569,Keren bapak Prabowo Subianto,,0.0
2024-05-13T08:03:21Z,@akangali5569,Yakin dulu aja beliau bisa,,0.0
2024-05-13T07:53:07Z,@wawankurnia8779,"Angkat hasil petani pak, kopi sama lada",,0.0
2024-05-13T07:44:36Z,@babaawi2256,Asam urat tinggi bisa bahaya negri kita,,0.0
2024-05-13T07:14:45Z,@Triad652,Prabowo itu orangnya tulus memimpin negri ini karna dia besar di rahim  Kopassus yang slalu setia untuk negri ini 🇮🇩🔥🔥🔥,,0.0
2024-05-13T07:12:07Z,@user-nk9fc5xu2l,Pak prabowo berhati mulia dan  berjiwa besar..❤,,0.0
2024-05-13T07:06:27Z,@UdvsusbUshus-ug4un,"Gk usah saya didukung ini itu gk penting, yg penting kerja peduli ama rakyat",,0.0
2024-05-13T07:05:37Z,@yindah4335,Pak prabowo tolong tuntaskan opm di papua,,0.0
2024-05-13T07:04:35Z,@sailormoon851,Kita lihat nanti apakah beban rakyat tambah berat ato jd lbh baik dr pemerintah sebelumnya...setlah joget2 alay saat pilpres😊,,0.0
2024-05-13T07:02:06Z,@user-kl8yw7ii4c,"Semoga pak prabowo bisa mensejahtera kan rakyat Indonesia tercinta ini,,, 🙏🙏🙏🙏",,0.0
2024-05-13T06:59:05Z,@amalkusnawan9625,😊😊😊,,0.0
2024-05-13T06:55:34Z,@user-zm1oc9gp7v,Ini lah yg di sebut pemimpin paningit..insya alloh,,0.0
2024-05-13T06:51:07Z,@user-df7ok3bc2y,"Menghabiskan sisa hidup demi Bangsa dan Negara itu wajar,ya pak bukan omon,omon krja nyata.",,0.0
2024-05-13T06:43:35Z,@yuliani6693,Mantab pak...,,0.0
2024-05-13T06:37:15Z,@leopratamshane,Berani hakim mk kita 5 orang bodoh,,0.0
2024-05-13T06:35:36Z,@GarnaRaditya,kosong,,0.0
2024-05-13T06:13:45Z,@user-lw2im3ym8d,"Kebanyak orang juga sudah pada tau kalau anda di dukung oleh pengemis dan gembel dari kalangan politikus lengkap dengan penjilat nya, bukan oleh rakyat.",,0.0
2024-05-13T06:12:43Z,@menangkanmerahputih8129,Mari kita dukung KPU dan Bawaslu dalam upaya mereka untuk mewujudkan Pemilu 2024 yang bebas dari intimidasi kekerasan dan kecurangan.,,0.0
2024-05-13T06:10:59Z,@nhcelluser-ok2cc,Indonesia tdk butuh omon2 orang gak penting  tapi yg dibutuhkan adalah kerja untuk  pemberantasan korupsi bulan moong ngalor ngidul  paham,,0.0
2024-05-13T06:00:01Z,@MuhammadAlisodikin-ih9bb,Sekelas ketua partai g malu bicara bgitu😢,,0.0
2024-05-13T05:59:07Z,@Toni-oc7yr,Pak Prabowo melawak wkwkwk,,0.0
2024-05-13T05:51:14Z,@user-qd7kc1ct2k,Kita dukung sepenuhnya,,0.0
2024-05-13T05:45:29Z,@jusmaniar6192,"Pak Prabowo uang UKT terlalu tinggi Pak Prabowo Gibran banyak anak-anak Yang tidak dan kurang mampu/ anak-anak Yatim untuk kuliah bahkan coba Bapak tinjau langsung banyak anak-anak yatim yang menangisi nasibnya untuk membayar uang kuliah ,biaya kontrak rumah biaya makan tolong perhatikan mereka Pak Prabowo dan Gibran",,0.0
2024-05-13T05:32:19Z,@LayarTanpabatas-kx7rs,Lanjutkan,,0.0
2024-05-13T05:18:11Z,@maydahlan4464,Di DUKUNG TUKANG NGIBUL KOK BANGGA?? MENANG CURANG KOK BANGGA??? EMANG DASAR MUKANYA PADA MUKA TEMBOK SEMUA!! MEMALUKAN DAN MENJIJIKKAN!!! <br>DAN PENDUKUNGNYA JUGA PADA DONGOK!! BOLAK BALIK DIKIBULIN TERUS OLEH SI JOKOPRETTT MALAH BAHAGIA!!,,0.0
2024-05-13T05:03:11Z,@kasmini3568,Jaya dan bangga buat indonesia.<br>Semangat pak prabowo,,0.0
2024-05-13T04:58:34Z,@FirdausPasiraya,Jujur itu lebih pak❤itu yg bln kuat kekar,,0.0
2024-05-13T04:54:35Z,@user-xf2hb2qf4f,"Saya tidak yakin dg apa yg di omongkan Prabowo, bahwa dia ingin meneruskan cita2 luhur Bung Karno. Karena di belakangnya banyak makhluk yg otaknya mementingkan Oligarki dari pada kepentingan rakyat. Dan menangnya saja dg jalan yg gak benar ... Filing saya indonesia akan semakin terpuruk karena makhluk2 yg otaknya bejat di belakang Prabowo",,0.0
2024-05-13T04:53:52Z,@supriyantosupriyanto7041,Wibawa❤,,0.0
2024-05-13T04:40:15Z,@user-oz2uo3gw1o,"Seluruh rakyat menunggu kerja nyatanya pak prabowo,,,,semoga mampu mensejahterakan rakyat secara adil dan makmur.",,0.0
2024-05-13T04:39:59Z,@gunturparty0179,ayo semua anak bangsa dukung uud peramasan harta korupsi 😅😅😅,,0.0
2024-05-13T04:35:47Z,@ipoonkznt7150,Kalau percaya org 2 yg di sbt tadi biar ke dpn tdk usah pemilu pada hal rakyat yg pilih maaf ya.,,0.0
2024-05-13T04:21:13Z,@yanamulyana6467,Menamg curang bangga loh najis 😂😂😂😂😂😂😂😂😂,,0.0
2024-05-13T04:20:51Z,@yanamulyana6467,Loh tu mensng di bsntu coooy sama pak lurah ksmpreeet coooyjngbangga loh curang bro hati hati loh krma loh 😂😂😂😂😂😂😂😂😂 serem,,0.0
2024-05-13T04:19:43Z,@yanamulyana6467,Preeeeeet 😂😂😂😂😂😂😂😂,,0.0
2024-05-13T04:13:55Z,@BIMA-666,SIAP SIAP DI JAJAH😂😂😂😂,,0.0
2024-05-13T04:03:09Z,@user-jl5rt8gg4o,"Menurut saya banyak yg mendukung.tapi yaa harus ingat,jangan menyengsarakan rakyat.para penjahat berdasi berlomba korupsi. Rakyat jadi korban guna untuk bayar utang negara.",,0.0
2024-05-13T03:52:34Z,@kadekduarsa8475,"Selamat menjalankan tugas Pak Prabowo...dalam dunia politik semua juga tau, tidak ada kawan dan lawan yg abadi...yg abadi hanyalah &quot;KEPENTINGAN&quot;...apakah untuk pribadi, kelompok yg mengatasnamakan negara, silahkan masyarakat yg menilai..!<br>Tapi sebagai partai...hanya PDIP lah yg konsisten dengan garis partai yg idialis...dan sy sbg kader sangat bangga dgn PDIP...kalau partai lain hanya cari selamat dan kedudukan.<br>Kami siap menunggu instruksi dari ketua umum...dan berharap berada di luar pemerintahan...karena hanya PDIP lan yg punya pengalaman sbg oposisi.<br>Oposisi penting sbg penyeimbang agar ada kontrol atas jalanya pemerintahan.<br>Bisa dibayangkan kalau tdk ada oposisi spt jaman orba...KKN dan korupsi merajalela di mana2.<br>Jadi...opsisi juga posisi yg terhormat...👍<br>Salam demokrasi...🤟🤟🤟",,0.0
2024-05-13T03:49:33Z,@orangindonesia2712,"Pak tolong semua preman dan begal2,yg ada di rumpin bogor dan koruptor beserta cucu2 nya dan kelurga nya di seluruh indonesia di petrus aja biar mampus semua",,0.0
2024-05-13T03:36:19Z,@veravera7119,😂😂😂😂 iya lah Bowo,,0.0
2024-05-13T03:15:29Z,@sutrisnosutrisno9842,Ternyata mereka sudah busuk.. demi dinasti bukan untuk rakyat... Hanya kebodohan rakyat yg masih mengikuti arahan penguasa demi dinasti,,0.0
2024-05-13T03:10:20Z,@yayathidayat6917,Menjijikan lihat pan demi jabatan. Pak Wowo buktikan aja kalau anda bisa kerja...meski saya ga yakin,,1.0
2024-05-13T03:10:11Z,@texascollection3874,kebenaran akan abadi ada pertanggung jawaban .,,21.0
2024-05-13T02:58:23Z,@kasiyantoahmad2912,Mulut mulat malit wo wo  ngedabrus mulutmu,,0.0
2024-05-13T02:56:50Z,@ramsesnababan1071,"Di tunggu pebdukungmu kerja nyatsmu, mkn siang gratis",,0.0
2024-05-13T02:56:22Z,@farazeasheza4425,Buktikan jgn ngedebus wo kerja,,0.0
2024-05-13T02:55:06Z,@WawanHermawan-gx7gd,Banyak nya orang komen bilang tanggung jawab di akhirat.<br><br>Apakah saudara saudara juga gak bakalan di mintai pertanggung jawaban di akhirat<br><br>Apakah punya kenalan orang dalam????? Gitu,,1.0
2024-05-13T02:46:02Z,@yusaharyyadi9807,Jendral terlihat lebih segar sekarang,,0.0
2024-05-13T02:45:27Z,@mtobing3103,"Mazmur 37 ,37 iyakan pak Prabowo juga Mas Gibran .❤❤❤",,0.0
2024-05-13T02:41:54Z,@zainidaenk,"Ayo mau apa ,,,",,0.0
2024-05-13T02:40:31Z,@basyirabdul9641,"Yuk jd pemimpin yg amanah, adil, tdk arogan dan sopan santun dlm berbicara, jgn menganggap yg TDK satu pikiran dianggap musuh....",,32.0
2024-05-14T10:01:05Z,@freemasonry666,Gw nunggu blunder2 wowo kedepan yg mempermalukan negara.<br>😂,,3.0
2024-05-14T11:00:55Z,@ibnukodir566,"Jangan Kya Joko , setiap yg tdk sepemikiran Lang sung di cap radikul/ anti nkri",,0.0
2024-05-14T12:44:22Z,@anita_mega,​@@ibnukodir566wkwkkkk radikal gmn?? pak prabowo aja lawan 2 periode tapi akirnya pak prabowo diajak ke kabinet..,,2.0
2024-05-14T13:50:00Z,@voisermeok5466,Justru yg gk searah adlh musuh,,0.0
2024-05-14T23:44:28Z,@Lifestider,"@@anita_mega itu urusan pak prabowo kenapa kita ngurus orang lain mulu, ngurus kita sendiri belum bener malah ngurus orang lain",,0.0
2024-05-13T02:30:25Z,@yesserputra1913,Betul betul .soalnya gak ada hasil slama ini buat negara,,0.0
2024-05-13T02:28:39Z,@Istiqomah-ry7lm,SALUT BUAT P.PRABOWO......BERJIWA PATRIOT...JANGAN HIRAUKAN PARA PEMBENCI YG TDK INGIN INDONESIA MAJU DAN MANDIRI,,3.0
2024-05-13T02:10:12Z,@dorxlab,Oooaalaaahh. Pantesan menang .. lha wong diendorse presidennya sendiri.. curang kok bangga,,0.0
2024-05-13T02:09:40Z,@alkalifi75,"Jalur langit nih bos yg mendoakan beliau, ngeri gk sih???....",,0.0
2024-05-13T01:44:07Z,@user-iv2ru4yi4v,Probowo ko kan ngotot pengen jd president...skrang ko udh kepilih...aq pengen liat ko bisa jd oresiden yg amanah nggak,,0.0
2024-05-13T01:41:49Z,@zainaldarmawan475,Waduh kok perasaanku jd gk enak saat mendengarnya😮,,0.0
2024-05-13T01:35:30Z,@meisyahytb5642,Kami tunggu buktinya kpmandan ! Jamgan omon omon doang,,0.0
2024-05-13T01:23:32Z,@BamBang-ib6uu,Yo tak titene pak wo iso pora mensejahterakan rakyatmu atau malah mensesarakan rakyat... 🙏,,0.0
2024-05-13T01:15:26Z,@user-uc5kv1kn1v,"Terserah pak wowo didukung siapa, walau gak didukung rakyat, tapi murahin tuh pajak  sembako murah pajak murah, pikir negara jgn pikir keluarga pak wowo",,0.0
2024-05-13T01:11:07Z,@tapak8330,"Jd seorg pemimpin tdk mudah,harus ada kerja baik bersama di dlm segara bidang,,harus komitmen menjlani tugas dgn baik dan benar agar semuanya bisa sama2 memajukan negara kito..slm sehat selalu,selamat bertugas,srmoga berhasil berdasarkan ❤❤ negara..",,0.0
2024-05-13T00:54:46Z,@lulukiswatun4610,Bu sri bu retno pak mahfud.pak bas.kalo bisa masuk kabinet lg bangsa ini msh bitih org2 spt mereka...kalo bisa bu susi tarik lg.,,0.0
2024-05-13T00:50:52Z,@taufikhidayat7557,Watak orang macam gini semua di bolak balik.....omonmu kita tunggu dan jangan omon omon aja...,,0.0
2024-05-13T00:42:14Z,@okbocilni1283,Sehat selalu... Ayoo semangat.. Buat negara kta. <br>Masa bodoh.. Tetangga sebelah. <br>Pasti meweekkkk😂😂😂😂,,1.0
2024-05-13T00:27:13Z,@zhrastry,Pak suharto kuat tapi jatuh juga,,0.0
2024-05-13T00:12:37Z,@aryakamandaka5711,Wartawan dongo bayaran nasi bungkus basi,,0.0
2024-05-13T00:02:07Z,@bennyoekasah9687,Yang penting bisa mensejahterakan rakyat indonesia,,0.0
