publishedAt,authorDisplayName,textDisplay,like_count,likeCount
2024-05-10T06:53:17Z,@budyensmarfawung6256,"kerja kan dan laksanakan perintah konsitusi, cerdaskan kehidupan bangsa pelihara fikir miskin.",,1.0
2024-05-10T06:48:42Z,@arisman-jc3ko,Urusan dunia &amp; negara sudah ada yg mengatur pak. Bismillah 💪💪💪💪🙏🎉🎉🎉,,24.0
2024-05-10T07:00:49Z,@starmakerhiburanku2222,Siapa yang mengatur nya mas,,0.0
2024-05-10T07:03:58Z,@arisman-jc3ko,@@starmakerhiburanku2222 yang paling kuasa Allah SWT👐👐,,4.0
2024-05-10T07:27:16Z,@dwipaartofficial172,@@arisman-jc3ko yg penting bukan no1 yg menang...ntar bs di rubah2 lg ..enak aja mau dirubah2 sudah maju begini,,1.0
2024-05-12T08:25:37Z,@MasturMastur-pd6to,"Iya ya mas,,,,nanti kita udah bener Jalan di sblah kiri trs di rubah jadi di sblah kanan.hehe,,,,bisa kaco.<br>Smangat NKRI.",,0.0
2024-05-10T06:47:21Z,@user-iy6ml7if8q,😮😢😅😂😊...pretttt....,,0.0
2024-05-10T06:46:49Z,@dudikurnia5806,👏👏👏 ternyataa...,,0.0
2024-05-10T06:44:17Z,@synfoldstar,DI TUNGGU JANJINYA UNTUK NAIKAN GAJI PEJABAT GAJI HAKIM DLL SUPAYA GA KORUPSI MEREKA YA PAK SAYA TUNGGU,,0.0
2024-05-10T06:42:56Z,@alinafsin9855,SUDAH MENANG....BEBAS AJA PAK.,,0.0
2024-05-10T06:40:13Z,@aryaputra1448,"Berlindunglah dibalik kebesaran ALLAH,jangan berlindung dibelkang manusia karena jika anda berlindung dibalik orang yg anda sebutkan tadi anda salah satu orang yg munafik",,0.0
2024-05-10T06:32:52Z,@dwihafizhw,Bangga? Tanggung jawabmu berat pak di akhirat nanti klo tidak bisa adil dan banyak rakyat yg masih sengsara. Semoga pak Prabowo bisa menjadi pemimpin yg amanah,,151.0
2024-05-11T00:34:03Z,@tips_dan_lainnya,Manusia tidak pernah adil..,,2.0
2024-05-11T01:16:39Z,@wongcilik5602,"​@@tips_dan_lainnya Memang manusia tidak ada yang suci seperti malaikat, tapi manusia harus berusaha untuk bisa adil dan menjadi org yg baik, kalo kamu punya pikiran seperti itu rusak dunia ini",,11.0
2024-05-11T01:27:14Z,@tips_dan_lainnya,@@wongcilik5602 bukan aku yg berpikir seperti itu.. Allah sendiri yang memberi tahu di Al-Qur&#39;an surat An-nisa ayat 129..  kalo kamu mengatakan saya punya pikirn rusak berarti Allah gimana membuat seperti itu ..,,3.0
2024-05-11T04:03:04Z,@yudhapratama9625,Kayak si planga plongo ya...,,0.0
2024-05-11T05:10:44Z,@user-nt6pm5zy7c,Kamu bawak alqur an tdpi kamu ngsk paham,,4.0
2024-05-10T06:31:22Z,@perawatofficial1449,"Wkwkwkw,... Kemarin gk ngaku",,0.0
2024-05-10T06:30:21Z,@user-gp9du2uw1j,Waktu y kerja kerja utk memajukan indonesia,,0.0
2024-05-10T06:28:21Z,@user-wq2rl1vt6s,Hahaha. Kasihan yg milih GK di anggap,,0.0
2024-05-10T06:25:37Z,@gusarichannel,berarti bukan kebenaran dong yg dukung bapak?  85% rakyat adalah kebenaran dan akal sehat...😄😄😄,,0.0
2024-05-10T06:25:22Z,@sumanbicu9778,buktikan dulu pak. gak usah omon&quot; dulu,,0.0
2024-05-10T06:24:27Z,@telurasinkjt5423,Biasa lansia kalau sudah tua suka curhat,,0.0
2024-05-10T07:28:12Z,@dwipaartofficial172,biasa yg kalah nyinyir2..😁😂,,0.0
2024-05-10T06:24:18Z,@Idem873,ingat anda bisa disana ada amanah rakyat bukan karena dukungan orang tertentu..,,0.0
2024-05-10T06:24:09Z,@konichiwa05,Ayo kita buktikan kinerjanya jangan sok pongah,,0.0
2024-05-10T06:23:23Z,@wonggunung7276,Ngedabrus mulu,,0.0
2024-05-10T06:19:31Z,@msohehamgoz9758,"Saya yakin pada waktunya Beliau takkan  terkena intervensi dari siapapun, Beliau akan menjalankan amanah sesuai dengan Pancasila dan UUD1945, aamiinn...",,0.0
2024-05-10T06:19:02Z,@epongalifgaming4342,Jadi kalo udah di dukung smua elit maka oakukanlah semau aja .. <br>Karna semua mendukung,,2.0
2024-05-10T06:18:45Z,@lyliareborn,Sy pilih situ karena ada gibran .jadi jangan kepedean .. kerja dulu yg bener,,0.0
2024-05-10T06:18:18Z,@JENYSStudioProduction,joss mantul pak,,0.0
2024-05-10T06:18:02Z,@AryanWirawan,"Ngemeng mulu, buruan kerja",,0.0
2024-05-10T07:29:03Z,@dwipaartofficial172,blm jg dilantik..🤣,,0.0
2024-05-10T06:16:55Z,@girangmarching1061,Sdh mulai arogan😂😂😂,,0.0
2024-05-10T06:14:58Z,@apfilm551,Berarti bansos itu bemer buat kampanye ya,,0.0
2024-05-10T06:12:23Z,@ahuiptk6945,Bnr kata alm. gusdur.. Org yg ihklas pimpin negara ini adalah prabowo...,,0.0
2024-05-10T06:11:58Z,@user-el5rj1ut3f,pak Prabowo jangan banya bicara mulailah berpikir untuk menagkap penjahat yg menyeleweng wang negara sejhtrakanbrakyat jgn hanya Bangi jatah mentri.,,0.0
2024-05-10T06:10:39Z,@nelsonsimorangkir9727,"Pilpres udah selesai. Rakyat sdh memberikan suara kpd Prabowo Gibran. Sekarang waktunya untuk melayani rakyat.  Urus dokumen macem - macem dipermudah. Klo lengkap dokumennya agar diproses secara benar. Buat SOP, biaya, dan time frame yg jelas agar rakyat tidak perlu bayar ekstra kpd petugas yg sdh digaji negara pakai uang pajak rakyat, buka lapangan pekerjaan yang seluas-luasnya dll upaya utk mensejahterakan rakyat. Pelayanan publik masih belum memuaskan. Menteri sibuk medsos kegiatan tapi tidak menyentuh pembenahan pelayanan di loket/ lapangan.",,1.0
2024-05-10T07:29:54Z,@dwipaartofficial172,dilantiknya bulan oktober...,,0.0
2024-05-10T06:08:24Z,@neniasavic6086,"Ntar makan gratis ngeluarin anggaran,,, angaran habis semua bahan pokok dinaikin supaya pulih,,,,golek pulian critane😅",,0.0
2024-05-10T06:02:18Z,@ethnicphone8148,"Pak prabowo lama2 jd asyik jg orgnya ,semangat pak",,27.0
2024-05-11T03:44:44Z,@budiyono4021,"Pokoknya pidato, pidato, pidato.... Masalah selesai ? Koruptor, pengangguran, pegawai honorer, kerusakan lingkungan, Banjir, maling ikan, maling timah, maling batubara, maling emas, maling nikel, maling minyak, maling pajak, preman berdasi dst.",,0.0
2024-05-11T15:36:33Z,@djarot199,​@@budiyono4021jagoan elu juga kalau menang belum tentu bisa nyelesaikan masalah yang elu sebut,,1.0
2024-05-12T00:16:20Z,@mehmetwaluyo3919,Kayak udah pesimis sipengkor gak Mamou kerja​@@djarot199,,0.0
2024-05-12T00:37:15Z,@djarot199,@@mehmetwaluyo3919 ngomong apa pula hewan yang satu ini gak jelas banget,,0.0
2024-05-12T00:47:09Z,@djarot199,"@@mehmetwaluyo3919 dia pengkor karena dulu perang bela negara,gak kaya elu cuman jadi beban keluarga dan negara",,0.0
2024-05-10T06:01:38Z,@irwanirwansyah2924,Eyang didukung seorang PENIPU ULUNG,,0.0
2024-05-10T07:30:39Z,@dwipaartofficial172,yg penting tdk didukung org2 intoleran...,,0.0
2024-05-10T06:00:08Z,@bimasukci1797,Betul,,0.0
2024-05-10T05:59:55Z,@user-tn7zh8lh8v,"mau lawan,  gush sok berkuasa otoriter intimidasi,  ordebaru datang lagi,  akan bnyak yg menyeala nntinya kawua,   etik etik ndasmu etik",,0.0
2024-05-10T05:59:12Z,@Mahardika36,"Jiahaha prabowo lanjutkan,",,0.0
2024-05-10T05:56:31Z,@andyani7167,Terserah bapak lah...terlalu banyak omon2...,,0.0
2024-05-10T05:54:21Z,@kulibgunan79,"laen x klo mrasa msh takut jadi pmimpin tak usah mencalonkan diri.ini mimpin negara,bkn untuk bljar memimpin",,0.0
2024-05-10T05:52:02Z,@KhalariAri-if1wc,"Tull rakyat juga banyak yang dukung.<br>Misal elit mengawasi bahkan menindak tegas bagi yang korufsi kami dukung.<br>Tapi kalau soal ketidakpuasan karena kalah, Mf itu Ambisi saya tolak.",,0.0
2024-05-10T05:47:20Z,@asesorishp6232,Klo mnurutku cma capres ini yg gk pede dgn kemampuan sndri,,0.0
2024-05-10T05:41:17Z,@budisasongko9093,"Pak Prabowo orang jujur banget, makluk bumi dan langit mendukunhnya, itu suara hati dari goib",,0.0
2024-05-10T05:40:00Z,@fnbstn32,PKS : Zetsu Putih<br>PDIP : Zetsu Hitam<br>Mereka Bersatu Menyerang Hokage ke 8 di kolom komentar,,0.0
2024-05-10T05:34:35Z,@brigadirz6058,"Walah, perkumpulan lapar uang negara!!!",,1.0
2024-05-10T05:32:19Z,@RAMADHAN.9T_,Gomong jangan gaco,,0.0
2024-05-10T05:30:50Z,@tunarsoraharjo1986,Hati-hati guyon sama pak Harto pak... Ada tukang baso di teras bapak nanti😂,,0.0
2024-05-10T05:29:55Z,@sutiirah9940,DITUNGGU SUSU ASAM SULFATNYA PAK PRABOWO WKWKWK,,0.0
2024-05-10T07:32:30Z,@okbdungsopetnangtennang2010,Pendukung Abah sabar ya kalau kalah 😂😂😂,,0.0
2024-05-10T05:29:14Z,@aesobrah3839,Percaya gk. Keluar kesombonganya kan? Itulah kejelekan pemimpin Indonesia.,,0.0
2024-05-10T05:28:56Z,@user-ke7gi9yu6k,inilah pemimpin yang dibutuhkan indonesia saat ini. era dimana harga tempe semakin terjepit. kebebasan yang kebabasan. sudah tidak saling hormat menghormati. menghina pemimpin negara. saatnya dibutuhkan pemimpin yang tegas. dibelakang pemimpin tegas ada orang orang pintar. didukung oleh negarawan negarawan sejati.,,0.0
2024-05-10T06:42:05Z,@tarimanuhuy2624,Harga tempe......lanjutkan.....,,0.0
2024-05-10T05:28:41Z,@gregoriushanggongu5738,Mantap Pak Prabowo.hebatttttttttttttttttt,,0.0
2024-05-10T05:27:29Z,@aesobrah3839,Cocok gk dg omonganua. Aku kok gk yakin,,0.0
2024-05-10T05:22:16Z,@user-bz6dr9gc8i,Yg paling penting bpk prabowo yg terhormàt kami rakyat jelata mendukung bpk sepenuh hati kami mohon bpk dpt menstabilkan harga beras gula dan minyak goreng sehat slalu bpk  prabowo skluarga aamiin,,0.0
2024-05-10T05:20:58Z,@user-uz7nx3ly5u,"Pantaasan demi mau menang menghalalkan segala cara. 😏😏😏😏<br>Tua bangka, umur udah lansia masih saja mau ambisi jdi penguasa",,0.0
2024-05-10T05:14:30Z,@dwiyani8288,Sak karepmu...pak,,0.0
2024-05-10T05:05:30Z,@keylameissy_8158,Pak g seharusx bilang&quot; mau ap mski didukung pak jkw&quot; malah kliatan g mampu berdiri tnp jkw.. sy rakyat biasa tunggu tindakan nyata dr jenengan.. bkb omon2 ngge pak,,0.0
2024-05-10T04:57:52Z,@baymact,"Kok bahas diri sendiri terus. Orang butuh tau masa depan negara bagaimana, bukan kehidupan pribadi presidennya.",,0.0
2024-05-10T04:56:50Z,@SonyaTacie,Ternyata bisa bercanda jg,,0.0
2024-05-10T04:55:16Z,@ahmadsuminto2522,Menjijikan,,0.0
2024-05-10T04:54:47Z,@singgihkuy6016,Buktikan krjanys pakkkkkkkk,,0.0
2024-05-10T04:52:33Z,@okisukmawan,"ge mas Dil pak Joe &amp; Bu Kam seen Sem saj Deng Saud Saud aa ing menjente kehakiman or&#39;# kembal saj Deng ikn diberhentok dik Sam Sud triliun adak cin cinsd di film jep kors ibdi or&#39; s., di: usa., Jancik babgvass jug l l",,0.0
2024-05-10T04:46:50Z,@user-ov4jr9gd6l,Banyak omon2 ya,,0.0
2024-05-10T04:44:27Z,@usmanfuadi5954,Semoga amanah ya pak... Bapak sudah punya segalanya dan umur sudah sebentar LG menghadap Allah SWT... Gak usah kejar dunia pak kejar akhirat dgn cara setia dan menjadikan Indonesia maju supaya rakyat makmur... Jgn korup ya pak,,45.0
2024-05-11T02:15:36Z,@muhartistik129,Kok tau kalau sudah dekat?😂,,4.0
2024-05-11T05:04:44Z,@theWhitenRed,Songong lu,,0.0
2024-05-12T14:45:02Z,@FebJoSa,"Bocah bocah😂 korup buat apa? Prabowo tajir dari lahir,emanga anis yg ngutang sans sini🤣",,2.0
2024-05-12T16:27:35Z,@debbieeffendi6851,Tidal tentu 😮😮😮😮😮,,0.0
2024-05-13T04:24:53Z,@barokahtante8148,Kadang kadang ente😂😂😂 nylekit,,0.0
2024-05-10T04:41:59Z,@user-di4uj2yw9g,Mntp didukung dari Bansos n Hambalang.,,0.0
2024-05-10T04:38:04Z,@user-su9tc7mk5o,"Dulu sy dukung pa prabowo, sy ga dapet apa apa!?? Malah bapak pindah haluan, 😭😭😭sedihhh buanget..pa..",,1.0
2024-05-10T04:28:31Z,@ronokusumo,"BUNG KARNO MARHAEN, SAMPAI SISA HIDUP GA PUNYA DUIT...GA KAYA MERTUA BAPAK,APALAGI KL BAPAK HARTA TRILIUNAN..BUNG KARNO TIPIKAL PERJUANGAN, DARI NOL DAN BANYAK PENDERITAAN MENUJU TUJUAN..PARTAI MANA YG KAYA GITU??YA CUMA 1 YG PARTAINYA DI OBOK2 SELAMA ORBA DAN DIBAKAR DIBANTAI, PARTAI LAIN KAN DIBANGUN DARI MATERI DAN PENUH LOBI-LOBI..MANA ADA PARTAI YANG ANGGOTA DPR NYA PAKAI JEANS DAN DUDUK DILANTAI MACAM ADIAN..TAU SUSAH,BUKAN TAU DUIT",,0.0
2024-05-10T04:23:50Z,@ShoPee-oc5yv,Mau kejujuran dmn anak haram konstitusi harus dibuang. Kalau tdk...<br>Berani semakin terbukti kemenangan dgn cara curang.<br>GOLPUT,,1.0
2024-05-10T04:20:06Z,@SFei92,Kita tunggu kedepannya apakah rakyat biasa bahagia atau tambah bersedih.<br>Dan apa kah rakyat 58% bisa berjoget2 kembali😮,,0.0
2024-05-10T04:20:03Z,@zlatannugroho976,Kerajaan inggris raya good seve the queen kerajaan indonesia raya good seve the king,,0.0
2024-05-10T04:17:47Z,@muhammadpamungkasakbar1479,Alhamdulillah,,4.0
2024-05-10T04:15:25Z,@mardiatisingkawang2390,"Cerita2 saja bah,nanti kedepan nya bagai mn,apa nyungsep ya....,",,0.0
2024-05-10T04:14:20Z,@rinaariyani73,"Keceplosan ya, jd di MK ga bener putusannya",,0.0
2024-05-10T04:09:23Z,@MarSi-ng7ov,Pak jngan sampai indonesia bubar tahun 2030 seperti omon2 bapak,,0.0
2024-05-10T04:09:15Z,@paragisatwa2645,Modol,,0.0
2024-05-10T04:07:58Z,@MarSi-ng7ov,Pantas menang pakai alat sembako sih,,0.0
2024-05-10T04:07:15Z,@purnamaharahap6828,DUA RATUS TRILIUN.HEHEHEE.,,0.0
2024-05-10T04:06:00Z,@robinsuro4669,"Saya mau bapak jadi pemimpin yg amanah,taat pada hukum dan tdk merubah aturan hny demi kekuasaan",,0.0
2024-05-10T04:05:51Z,@purnamaharahap6828,Asal jangan cerita saja lah pak Bowo masalah korupsi aja tuntas sudah jelas rakyat sejahtra masalahnya brani gak lawan orang orang korup ini.soalnya UUD nya gak ada hukumnya menyita asset yng korup lawan lah pak oknum oknum DPR yng belummau mensahkan UUD nya.saya di yakin kalau korup bisa di amankan jelas rakyat sejahtra tapi saya pikir pak Wowo gak brani sita harta orang orang yng korupsi.,,0.0
2024-05-10T04:04:31Z,@ADITYANUGRAHA0032,Mau apa anda para rakyat Indonesia?,,0.0
2024-05-10T04:03:55Z,@hanunhanun2792,Humoris Bapak kita ini..,,0.0
2024-05-10T04:03:13Z,@durianmusang7216,Sudah mulai kelihatan 😂😢😮 nyok jogetin aja,,0.0
2024-05-10T04:02:46Z,@IsmailIsmail-lr8hj,Lihat aj jalan nya nnt pemerintahan nya.baek dn buruk nya nnt rasain aj wahai rakyat.,,1.0
2024-05-10T04:02:38Z,@santinando7574,Indonesia menunggu hasil kerja nyata  anda pak Prabowo...,,152.0
2024-05-11T03:40:44Z,@budiyono4021,Bukan sekedar pintar pidato. Ya kan... Ya kan..ya kan... Seolah gak PD.,,4.0
2024-05-11T04:02:24Z,@humoria2038,Mangnya Anies cuman jago omon wkwkwkw​@@budiyono4021,,0.0
2024-05-11T05:18:34Z,@mochsohibi6748,​@@budiyono4021yang lebih penting itu kerja nyata. Pidato no 2,,3.0
2024-05-11T05:45:59Z,@FebJoSa,​@@budiyono4021 noh liat pertahanan kita dan rank militer global indonesia naik lagi jadi rank 12,,0.0
2024-05-11T05:54:01Z,@andrienovalian650,"BELUM JUGA DI LANTIK, BANYAK BACOD KAU AMJIMK",,0.0
2024-05-10T04:00:24Z,@careuh_bulan.,WAJAH PERSIDEN RAKUS .,,0.0
2024-05-10T03:59:13Z,@DikroSupriayadi,Mantap,,0.0
2024-05-10T03:58:16Z,@lenodrcipto4623,Namanya juga cawe cawe.,,0.0
2024-05-10T03:57:03Z,@robromans7733,sudahlah pak tua.fokus ke depan...keliatan anda gamang...,,0.0
2024-05-10T03:48:31Z,@AnggyferdyAnggy-xn6wt,Mantap presidenku ✌🏻✌🏻🇮🇩🇮🇩,,1.0
2024-05-10T03:46:48Z,@pradamohsolikin-vd1jl,"Hanya Megawati yg ga mendukung, biarin aj tar sadar jg.",,0.0
2024-05-10T03:44:42Z,@rmohammadpamungkasalbiruni3839,Gak malu...,,0.0
2024-05-10T03:42:50Z,@muhammadendarualwafi2846,Hidupkan lagi PETRUS JILID II pak...,,0.0
2024-05-10T03:39:23Z,@user-ei1er5wi4d,"Sekarang berani ngomong begitu kemarin ga berani ngomong apa2 , kura 2 dalam perahu",,0.0
2024-05-10T03:34:51Z,@vincentfererriuskabosu189,Setuju bapa. Gasssss bapa Prabowo 😁😁😁💪💪💪💪🇮🇩🇮🇩🇮🇩🇮🇩,,0.0
2024-05-10T03:34:02Z,@abdu7095,"Prabowo: <br>&quot;Jangan ganggu kami, kami ingin fokus kerja&quot;<br><br>Megawati:<br>&quot;Tidak bisa begitu. Anda itu tidak sah. Harusnya anda jadi petugas partai!&quot;",,1.0
2024-05-10T03:33:21Z,@martabakpisang9531,Jangan lupa makan gratis,,0.0
2024-05-10T03:30:01Z,@mujionoyono9709,"Yaa kalau soal merasa didukung, semua orang bisa bilang itu",,0.0
2024-05-10T03:24:53Z,@lindaasnawati3733,sy sarangkan pak prabowo harus percaya diri.,,0.0
2024-05-10T03:24:25Z,@edinasitohang8735,Tunjukkan dulu kemampuan bapak jangan cuma di dukung a b c,,0.0
2024-05-10T03:20:17Z,@drajattt,Dukung pasti dong... Apalagi bila 5 tahun kedepan terwujud dan terbukti membawa indonesia lebih baik,,0.0
2024-05-10T03:18:01Z,@andiky1,"Sampaikan ke MK harusnya Pak, biar gak tersesat MK nya...😅😅😅",,0.0
2024-05-10T03:13:22Z,@bacakomik6556,😊😊 Saatnya Negara kita MENGUASAI KEKAYAAN  LEGARA LAIN..😊😊😊,,0.0
2024-05-10T10:56:37Z,@tukijem754,Yakin???,,0.0
2024-05-10T03:04:20Z,@shityplace,Dulu ngejelek&quot;in sekarang menjilat-jilat menjijikan,,0.0
2024-05-10T03:03:53Z,@jihanmurtadhohanafi6344,Mkmkmkmkmkmk,,0.0
2024-05-10T03:03:08Z,@TaufikKamil-vf7uh,Ditunggu kerja nyata nya...mendukung menolong mensejahterakan rakyat...jgn omon omon aja ya pak,,369.0
2024-05-10T04:14:45Z,@e.s858,"Tenang cukup kasih makan siang, janji ditepati, sisanya kami nikmati bersama",,16.0
2024-05-10T05:45:53Z,@NovalAditya-iy8rl,"Ngimpi sejahterakan rakyat, klo klo rakyat belum dapat gajih dari pemerintah",,8.0
2024-05-10T06:23:18Z,@hsentarum0129,"baru tau kan omon 2x, kalo sdh begini , anda bisa tebak kedepan nya. jend sudirman kelupaan pak, juga dukung bapak.",,7.0
2024-05-10T06:24:20Z,@CeR247,...ngasih makan gratis...aja masih bingung !!!,,15.0
2024-05-10T07:36:00Z,@cadastotok827,Kenapa sih pada sirik.dilantik aja belum.,,5.0
2024-05-10T03:02:05Z,@user-kj5cw2nc2q,❤Sby❤ku❤,,1.0
2024-05-10T03:01:22Z,@khalikulbahri2317,Makanya menang telak😂😂😂 tapi yg plg berjasa mahkamah keluarga😂😂😂,,0.0
2024-05-10T02:59:11Z,@wk6355,Halahhh ... <br>Mau di dukung si Wiwi .. SAY .. Keluarga Sengon .. partai politik .. yg jelas Republik ini adl miilik seluruh rakyat Negeri ini BUKAN warisan keluarga nenek moyang kalian saja .. ! .. 🤔 ..<br>Apalagi seluruh rakyat Republik ini &amp; dunia tahu bhw 02 menang Pilpres dgn Kecurangan .. 😅 ..,,0.0
2024-05-10T02:57:23Z,@taufikrahman2403,"Wahai kpk dan kejaksaan,,Piye dugaan kkn di Kemenham.",,0.0
2024-05-10T02:57:18Z,@barryprima7893,Semoga Prabowo mengurus negara Indonesia dengan baik,,0.0
2024-05-10T02:56:10Z,@anggazakaria8401,Omongan nya Wowo G Bermutu ahh😅,,1.0
2024-05-10T02:55:56Z,@azm_shantung5705,Ngandelin di belakang.. boneka ne yeeeee...,,0.0
2024-05-10T02:55:55Z,@danisetiadi917,Mau berdikari tapi sudah ancang2 impor sapi....<br>Lebih gila lagi bukan hanya impor beras tapi sekaligus mau impor petani.... jiiiaaannnn hebat tenan,,0.0
2024-05-10T02:55:07Z,@user-rg4ql7zl1g,Sampai hari ini kemiskinan meningkat. PS bisa apa ???,,0.0
2024-05-10T02:53:30Z,@CetingBH,"Ini kacang tidak lupa sama kulitnya, mantap tanda org setia",,0.0
2024-05-10T02:52:09Z,@aldojavera6764,wowo kampanye udah lewat wowo.,,0.0
2024-05-10T02:50:56Z,@aldojavera6764,grambolan paman usman,,0.0
2024-05-10T02:50:05Z,@wulansriwulansri715,Betul alm.kyai abdurrahman wahid mendukung bapak,,0.0
2024-05-10T02:48:59Z,@Fauziyah-us8le,Rakyat  butuh kenjataan bukan janji janjji,,0.0
2024-05-10T02:47:26Z,@paultohatta5459,Hebat....siap2 tambah hancur negara ini...😂😂😂😂😂,,0.0
2024-05-10T02:46:41Z,@karetpecah,Merinding saat sebut bapak Gus Dur. Masya allah tabarakallah.,,5.0
2024-05-10T04:18:28Z,@yamanmadusendang9486,Ramalan Gusdur  CES pleng,,0.0
2024-05-10T04:42:49Z,@user-di4uj2yw9g,Gak lama bakal dipanggil gusdur cs..,,1.0
2024-05-10T02:45:40Z,@azistamam3011,Bapak Prabowo menang karena tiap pilpres sudah di kenal emak-emak otomatis bapaknya dukung juga 😂 dan sekarang di dukung oleh anak-anak zaman now tambah kuat 02... silahkan hitung sendiri.😂😂😂,,1.0
2024-05-10T02:44:10Z,@BumiaMia,"Bapak, kuliah untuk UKT kenapa skr mahal 😔🥺... Tlong pak kami ini orang kecil mau kuliah saja kok mahal.. 😢😢😢",,5.0
2024-05-10T09:36:52Z,@user-lw4go1cv6d,"❤Iya kan , kalau yg jadi p gsnjar mungkin lain . Satu keluarga hrs ada satu mahasiswa .",,1.0
2024-05-10T10:23:01Z,@BumiaMia,@@user-lw4go1cv6d iya kak.. jujur skr sy rakyat kecil sederhana ini sedih kak.. cita - cita dan berangan angan ini anak bisa kuliah.. pupus harapan.. 😔🥺😥😥,,0.0
2024-05-13T10:11:38Z,@nadhifaulia5191,Udah jangan mengeluh.. kalau gak mau kerja sama jangan berisik. Kami  mau kerja wkwkwkwkw.<br><br>Prabowo,,0.0
2024-05-13T20:58:08Z,@BumiaMia,@@nadhifaulia5191 gimana ini kuliah kok mahal bgni 😔🥺😥,,0.0
2024-05-14T08:02:54Z,@abdulrifai7648,Sabar pak Prabowo blm dilantik Mentri blm terbentuk,,0.0
2024-05-10T02:42:56Z,@sutarajja1294,"Klu prabowo menetuskan jejak jokiwi , berarti Berdiri di atas kaki china .",,0.0
2024-05-10T02:40:30Z,@CnCgarislucu,Weleh2..  Coba nanti indonesia makin baik apa makin korup..?!?! 😢,,45.0
2024-05-10T05:54:37Z,@user-wt8rz9vy8k,Sekrng masih saja bermunculan korup baru,,2.0
2024-05-10T15:31:15Z,@MalamBagaiSiang,Ciri2 negara korup itu harga2 turun. Rakyat sejahtera...tapi tetap negara berkembang. Karena tak ada pembangunan yg &quot;berarti&quot;,,0.0
2024-05-11T03:22:41Z,@mhcbliss,Semoga gak sekoorup Orbaa<br><br>Sedih inget 98 krismon tuhh,,1.0
2024-05-11T18:30:57Z,@chabibpurnomo9744,Ngomong apa sih ​@@MalamBagaiSiang,,1.0
2024-05-11T23:18:44Z,@garasmania7991,Makin ajur ju2,,1.0
2024-05-10T02:39:48Z,@mecca1881,Wow,,0.0
2024-05-10T02:39:23Z,@jurnalDee,Ora penting juga siih.. seng untung ya gerombolane rika.. seng makmur ya gerombolane rika.. rakyat cilik ora kerja ya ora mangan ora udeng berobat..,,0.0
2024-05-10T02:36:14Z,@kadekardiyasa9555,"Wajar pk prabowo sombong karna sdh 2x klh pilpres,skrng buktikan jnji&#39;a kmpnye sya ttep pendkung setia gama🤟🇲🇨",,0.0
2024-05-10T02:33:52Z,@user-db5rw7rr2q,"Yang menang itu ngomong apa aja masuk, yang kalah sakit hati merasa ditipu, biasa.. baru kerasa tukang tipu kena tipu itu sakit, mari musnahkan PDIP biar gak ada lagi tipu tipu wong cilik😄",,0.0
2024-05-10T02:31:24Z,@user-in2oy2sg5j,Mantap pak sehat selalu,,0.0
2024-05-10T02:30:38Z,@CatatanWarso,"Ditunggu makan gratis, IKN, gaji naik buat pejabat, rumah buat guru, dan janji janjinya",,0.0
2024-05-10T02:30:26Z,@dyienaprincessrezy5585,Anak abah psti kepanasan klo liat bgnian😂😂😂<br>Menyala bapak akuuu💙💙💙💙,,0.0
2024-05-10T02:24:59Z,@TatangAyi,"Bagi kemenangan Pak Prabowo bukan untuk 96,2 Juta aja, Tapi untuk seluruh Rakayat Indonesia dan Kemenangan tidak semata mata dukungan 96,2 Juta sebab ada Faktor KUNFAYAQUN.",,0.0
2024-05-10T02:21:26Z,@Shortofficial223,😊😊9<br>9 daaa,,0.0
2024-05-10T02:20:56Z,@user-it4fy7xf1f,Ini orang Pernah di Pecat atau di berhentikan dari Militer Yaa ?? Pernah Ke Yordania Jugaa Ya setelah kejadian Mei 1998 ?? Kira2 apa kasus ini orang sehingga di pecat dari militer Yaa ??,,0.0
2024-05-10T02:18:42Z,@ibadjm8201,Smoga dapat hidayah...aamiin yarobal alamin,,0.0
2024-05-10T02:18:06Z,@dani0150,Sombong wo.... smkin kpngin  muntah ooooo.....,,0.0
2024-05-10T02:17:09Z,@LaodeMuhWahid,❤❤❤,,0.0
2024-05-10T02:16:55Z,@gatotbaliid,Anda didukung orang yg tdk bermoral dan beretika artinya anda sama tdk bermoral dan tdk beretikanya dg dia.,,0.0
2024-05-10T02:15:04Z,@TatangAyi,Kan Pak Prabowo sudah Membuktikan jelas nyata dan Fakta : Dari Lawan Di Jadikan Kawan tidak seperti Siapa itu ( Di dukung di Suport Eeh malah Pak Prabowo di Jadikan Lawan ),,1.0
2024-05-10T02:13:51Z,@sudirmanibnulandupe7453,Iyalah buktikan aja kedepan rakyat menunggu ini. Jangan omon-omon doang,,54.0
2024-05-10T12:12:35Z,@yusufhendarno5687,Betul. Palingan cuma omon2 doang... ngomong aja bingun bingun gitu... 😅,,5.0
2024-05-11T01:21:17Z,@rokhani5562,Syirik banget lu dul😀😀,,3.0
2024-05-11T02:16:29Z,@Adenito_,😂😂😂,,0.0
2024-05-11T03:26:37Z,@fahadshabir4l4nsy4h8,​@@yusufhendarno5687  kalah. Itu. Sakiiiitttt dul,,1.0
2024-05-11T04:07:12Z,@muzha-qj6do,Buruknya hati mu tak terima kekalahan 😂😂😂😂😂😂😂,,1.0
2024-05-10T02:13:03Z,@asepwanwan8797,Prabowo mulai tegas ~~~,,1.0
2024-05-10T06:45:01Z,@tarimanuhuy2624,Bukan tegas bro...itu watak aslinx kluar......bentr LG Joko diprank.....,,0.0
2024-05-10T02:11:54Z,@kadekdwi2066,Dr pernyataan prabowo PDIP harus pada posisi oposisi.,,0.0
2024-05-10T02:09:58Z,@alatasdaun3445,oke gas oke gas😂,,1.0
2024-05-10T02:07:45Z,@pujiramadhan396,"pak Prabowo memimpin negara ini berat  selalu minta pertolongan Allah ,jangan tinggal solat lima waktu",,0.0
2024-05-10T02:06:55Z,@AFSURD,"Ngeri negeri ini, begini ada rakyat uda diancam apalagi nanti kalo uda dilantik, no comment dah rasakan itu mayoritas pemilih gemoy",,0.0
2024-05-10T01:57:15Z,@bayusinatra7106,Pasangan yg serasi satunya pelanggar ham berat satunya pelanggar konstitusi.. hhh dosa apa bangsa ini,,0.0
2024-05-10T01:57:00Z,@yoadp,"iya iya.. ntar kalo krisis ekonomi, urus sendiri ya.. sama rakyat2mu itu...",,1.0
2024-05-10T01:50:36Z,@akbarm5914cannel,Pantesan cawe cawe,,0.0
2024-05-10T01:50:20Z,@Karyasastraholis,Silaturahmi mempermudah jalan rezeki.,,0.0
2024-05-10T01:47:11Z,@rusminini-sh9do,pak prabowo panjenengan punya partai .mudah 2 han pak joko tetap setia sama sampeyan.Amanah nggih pak.jaga rakyatmu yg ada di bawah.supaya hidup sejahtera.gemahripahlohjinawi nggih pak,,0.0
2024-05-10T01:46:54Z,@MrWenkerz,Makan siang gratis blm mulai...uang kuliah yg naik duluan.... rakyat blm dikasi makan tp udah jelas bakal makin bodoh,,1.0
2024-05-10T02:56:48Z,@user-dv5gk1nb4r,kamu termasuk rakyat yang makin bodoh ya?,,0.0
2024-05-10T01:46:45Z,@mbahresodiharjo1979,"Mau apa saudara&quot;sekalian 😄😄 tunjukkan dgn kinerja, sejahterakn rakyatnya 🙏",,3.0
2024-05-10T01:42:48Z,@iketutlesmana4754,"Siap p president, sekarang tinggal menunggu sinkronisasi antara janji2 yg sdh bpk ucapkan dgn pelaksanaannya di lapangan.",,0.0
2024-05-10T01:42:06Z,@doli64,rakyat tunggu janji janji anda .untuk rakyat,,0.0
2024-05-10T01:41:36Z,@mastotoxnugraha7379,"Nanam singkong aja gagal pak, tak tunggu kinerja mu.",,0.0
2024-05-10T01:37:34Z,@korinusgefilem7915,Pak bisa nambah waktu makan gratis nya..makan pagi gratis dan makan mlm gratis..wkwkw,,0.0
2024-05-10T01:36:13Z,@Q-Pong5058,Waduh ga bahaya ta😂,,0.0
2024-05-10T01:36:07Z,@srisuharso323,😅😮😅😮😅😮😅<br>hhhhhhhhhuuuuuuuuuuaaaaaaaaannnnnnnccccccccchhhhhhhhuuuuuuuuuuurrrrrrrrrggggghhhhhhhhhhhhhh<br>😅😅😅😮😮😮😅😅😅😮😅😮😅😮😅<br>hhhhhhhhhuuuuuuuuuuaaaaaaaaannnnnnnccccccccchhhhhhhhuuuuuuuuuuurrrrrrrrrggggghhhhhhhhhhhhhh<br>😅😅😅😮😮😮😅😅,,0.0
2024-05-10T01:34:01Z,@jonbudi,ok,,0.0
2024-05-10T01:32:26Z,@shasiejuniors8900,Tunggu 2thn lagi..,,0.0
2024-05-10T01:31:45Z,@cucueyang709,Jendral jembutttt..,,1.0
2024-05-10T01:29:25Z,@jir0lupat,KOCLOQ😂,,0.0
