publishedAt,authorDisplayName,textDisplay,like_count,likeCount
2024-04-23T22:46:35Z,@mranggenmranghen9769,Semoga amanah ya bapak❤,0.0,
2024-04-23T16:28:37Z,@user-uu5qx4lo1n,Curang,0.0,
2024-04-22T13:14:02Z,@porwanti8152,Prabowo sombong😡,0.0,
2024-04-20T16:17:07Z,@endangsulastri9372,Saya berdoa supaya apa yg dikatakan Prabowo terjadi yaitu menghilangkan kemiskinan.,0.0,
2024-04-19T12:02:11Z,@HanilNi,"Awas awas hati hati kata jokowi, prabowo hati hati akan ada yg terjadi kena penyakit \",0.0,
2024-04-15T20:13:57Z,@user-nv4vv9lj3m,"Presiden Indonesia maju Indonesia kuat 
Prabowo Gibran
 Tolong  pak aplikasi yang merusak mental anak2 bangsa 
Di hapus dari Indonesia karena aplikasi tersebut sangat  merusak generasi bangsa contoh judi online dan porno Grafi. Agar Indonesia aman dan sejahtera.",1.0,
2024-04-15T18:06:08Z,@user-sq1vr9kr6s,Saya berdoa jika pak prabowo jadi presiden semoga bansos di pedesaan lancar dan tidak ada kecurangan sepihak dari tingkat rt sampai kepala desa tertentu ,0.0,
2024-04-15T10:27:01Z,@user-dg5ek6ek5x,Probowo lebih baik daripada Anies. Tidak sia sia perjuangan saya selama ini.,0.0,
2024-04-14T14:32:30Z,@Altaf-yc5fr,Pk prabowo persiden ri bukan anis bayak omong,0.0,
2024-04-12T11:22:24Z,@ysdorpheus,Selamt presidenku,0.0,
2024-04-10T01:01:15Z,@kigedeagungpamungkas9034,Pak prabowo president RI,0.0,
2024-04-07T10:59:37Z,@MuhammadAinul-el9yr,Menyala bapak ku prabowo gibran all in.,0.0,
2024-04-06T16:43:18Z,@user-pu9yt4wq5x,Pak Prabowo sebentar lagi menjadi presiden Indonesia ini tanah subur dan banyak tambang  selalu amanah jadikan rakyat Indonesia makmur semua jangan kalah dengan negara lain kuat dan menjaga negeri ini aman panjang umur sehat selalu ✊✊,0.0,
2024-04-06T01:21:48Z,@user-ke3qu5wb6l,pasti donk,0.0,
2024-04-01T21:41:13Z,@alexleu9118,"Gua ikuti kata GUSDUR, ",0.0,
2024-04-01T19:35:31Z,@FAUDI150,genggam janji mu pak jangan sampai masyarakat kecewa,0.0,
2024-03-31T18:30:36Z,@anggisatrio2485,Presiden aja lama gmn calegnya😂,0.0,
2024-03-31T07:59:09Z,@Erikamanda600,Alhamdulillah! Makan tu orang2 yang ngeremehin🗿,3.0,
2024-03-30T12:01:05Z,@RikardoMage,Amin,0.0,
2024-03-30T09:30:14Z,@ruhuyan,Bahwa kami dari  Kalimantan selatan telah memberikan suara sah kepada bapak presiden Prabowo Subiantu presiden Republik Indonesia. kami juga butuh perlindungan dari pemerintahan yang kuat hidup presiden Prabowo Subiantu salam hangat dari Saya fitrus putra Dayak asli Meratus gunung Pendihan Provinsi Kalimantan selatan Kabupetan  Hulu Sungai Tengah Kecamatan Hantakan Desa Haruyan Dayak RT 04 RW 02.,0.0,
2024-03-30T09:22:54Z,@ruhuyan,"saya fitrus dari kalimantan selatan bahwa Prabowo Subianto Masih hidup, jadi kami dari Kalimantan Selatan akan selalu dukung pak Prabowo menjadi presiden Republik Indonesia.",0.0,
2024-03-27T02:17:14Z,@febrinovan7283,Pak prabowo pasti menang,0.0,
2024-03-23T15:04:25Z,@agusgu3336,Ciptakan lapangan kerja buat rakyat pak.  Jgn tarsok tasok trus setiap ganti presiden  indo semakin trpuruk ga da lampang kerja,0.0,
2024-03-20T07:32:43Z,@putrasuryana8762,"Ciptakan lapangan kerja,  untuk Anak bangsa
Dan tenaga kerja Asing tiadakan",0.0,
2024-03-19T17:13:20Z,@kevinMTVlog,Semoga lowongan pekerjaan makin banyak dah rakyat susah berkurang..,0.0,
2024-03-19T17:12:35Z,@kevinMTVlog,Alhamdulillah pak prabowo jadi presiden hormat untuk pak Prabowo,0.0,
2024-03-19T12:30:03Z,@Sankidz09,Selamat.....Prabowo Prabowo . Sekarang ngomongnya gtu bsok harga naik subsidi dicopot .,0.0,
2024-03-18T10:30:57Z,@anangferdian9189,Gak pernah dapat bantuan,0.0,
2024-03-17T10:39:46Z,@diahayulistantiputri-hg6og,"Ya lah harus yakin,jangn terpengaruh yg bilang 02 curang. semoga pak prabowo jdi presiden ",0.0,
2024-03-16T18:03:32Z,@Agungjika1221,Siapa saja yang menjadi presiden kami akan dukung 1000 persen dan kami akan doakan selalu dalam lindungan Allah dipermudah urusannya di sehatkan jasmaninya rohaninya Amin ya Allah ya robbal alamin Allah yang mengangkat,1.0,
2024-03-16T13:59:07Z,@HeriHeri-um8ws,Ya allah beri kemenangn kepada bpk prabowo..amin,1.0,
2024-03-14T10:35:35Z,@iwanalfitrah5088,Penghianat,0.0,
2024-03-14T02:33:28Z,@muhammadandria8162,Kok lama pemilu februari kan,0.0,
2024-03-13T14:05:21Z,@rizkiafriansyahlubisrizki4069,Lama kali di lantik nya,0.0,
2024-03-12T14:02:28Z,@user-ri1go6up8b,Mimpi ,0.0,
2024-03-11T14:08:22Z,@sudirmansudirman5300,"Masyarakat Indonesia berharap pak presiden,nanti,bisa menumpas pejabat negara koropsi",1.0,
2024-03-10T14:17:13Z,@user-hc2ml1pc8i,"Bisa sangat hancur ini Indonesia dipegang Sama dia,yang gak bisa apa2 ",1.0,
2024-03-10T06:46:44Z,@AtoNurdiana,Rakyat kecil menderita,0.0,
2024-03-10T06:45:56Z,@AtoNurdiana,Saya sebagai rakyat kecil. Saya dukung Pa prabowo sudah 2 kali. Sudah ga sabar di  Lantik. Mau lihat perkembangan sama rakyat kecil,1.0,
2024-03-10T01:59:06Z,@AMP.ameliamariskaputri,Prabowo presiden,0.0,
2024-03-09T19:32:32Z,@bg_adi_dht,senang nya hati aku semoga pak prabowo amanah,4.0,
2024-03-09T00:20:17Z,@tokosby6906,ambisi bgt pak,0.0,
2024-03-08T07:42:59Z,@user-qt5ef7xz7o,Siapa pun yang jadi presiden kita serang Israel setuju,0.0,
2024-03-08T03:17:59Z,@user-sh5ew3fu4c,Omongan gusdur adalah bukti pemberintahuan dari Allah swt kepada kita bahwa negara kita akan di pimpin oleh pak prabowo,11.0,
2024-03-08T00:19:40Z,@user-ot7kr2ww6x,Banyak pengganguran pak berikan lowongan kerja ,2.0,
2024-03-07T19:50:15Z,@EkiBae-bb3on,"Sekarang aja di lantiknya, pak kami sudah sangat sulit . Sempit nya lapangan pekerjaan",0.0,
2024-03-07T11:44:13Z,@user-ws7zl7cc5g,Hacurkan kemiskinan di Indonesia ini,0.0,
2024-03-07T11:00:44Z,@_USU,Presiden haram,0.0,
2024-03-07T08:12:15Z,@Ferrikepahiang,"terharu gua bahagia,terimakasih ya Allah,alhamdulillah🎉🎉❤",8.0,
2024-03-07T07:36:50Z,@UdinSalleh-vq8pf,Lebih parah lagi pak parabowo di bandingkan pak Jokowi memimpin Indonesia ,0.0,
2024-03-06T17:54:47Z,@coral4652,Indonesia di guyur badai🌪,0.0,
2024-03-06T11:18:41Z,@alfarizi127,"INGAT SELISIH JAUH,YANG KALAH HARUS terima,PILRES AMAN DAMAI ",0.0,
2024-03-06T01:02:11Z,@sandylaning1119,Prabowo Subianto jadi presiden j,0.0,
2024-03-05T16:01:29Z,@MohTarom-si8uw,Presiden ku no 2,0.0,
2024-03-05T08:55:22Z,@user-xo7dp5pi2v,Prabowo presiden ri ke 8 mantap,0.0,
2024-03-04T21:26:38Z,@napipoly4485,Menyala Abang ku,0.0,
2024-03-04T18:38:45Z,@mardianpaleka5602,Menyala Bapaku❤️,4.0,
2024-03-04T18:38:24Z,@mardianpaleka5602,Aamiin Prabowo presiden nya,1.0,
2024-03-04T13:48:30Z,@ndokyas4576,"Semoga mulutmu busuk dimasuki belatung , kamu berdoa agar bpk prabowo untuk jadi di lantik kamu busuk hatimu akan kemasukan belatung ya....",0.0,
2024-03-04T10:42:04Z,@lianamayvia8884,Insya Allah Bapak Prabowo Subianto menjadi Presiden RI yang baik dan amanah,6.0,
2024-03-04T08:54:59Z,@achsofiharyadi2213,Ini tv nya Surya Paloh 😂,0.0,
2024-03-04T06:40:15Z,@AraSinatria,"Iya harus yakin, jangan terpengaruh oleh media yang pemiliknya mengalamai kekalahan",1.0,
2024-03-03T17:42:08Z,@ibenboy1570,Alhamdulillah udah ga sabar liat pak Prabowo di Lantik presiden RI 2024,13.0,
2024-03-03T07:58:25Z,@insiatun1693,"YG JELAS PRABOWO DIPILIH SEKRANG AJA UDH 75 JUTA RAKYAT, YG MENGANGGAP CURANG SM DNG MENCURI SUARA RAKYAT",1.0,
2024-03-03T06:43:02Z,@alvariel560,semoga allah tidak izin pengkhianat jd pemimpin ,0.0,
2024-03-02T16:06:11Z,@samijahsamijah7505, METROTV  NARASI NYA DARI DULU MIRING MIRING kalau SOAL PRABOWO,0.0,
2024-03-02T16:05:07Z,@samijahsamijah7505,MAJU TERUS PAK PRABOWO JADI RT SAJA  BANYAK YG PRO DAN KONTRA KOK REPOT,0.0,
2024-03-02T14:57:10Z,@BrandalSurgo,"Kalo Sudah Jelas Paslon 02 paling banyak curangnya, Ya HARUS DIVONIS KALAH. 
",0.0,
2024-03-02T14:45:41Z,@user-ex5cb5pg4t,JeLAS PRABOWO JD PRESIDEN KaReN CURANG,0.0,
2024-03-02T13:24:14Z,@bodronoyo..1372,"Semoga menjadi presiden NKRI yg amanah...
",0.0,
2024-03-02T13:20:17Z,@indrabakti7404,hukuman yang berat,0.0,
2024-03-02T13:14:21Z,@user-jz2pv9ms6q,Jgn mimpi mas masih proses 😂😂 rakyat republik Indonesia siap tempur untuk jaga NKRI,1.0,
2024-03-02T13:13:20Z,@albinersitumorang1205,"Sebenarnya apa yg salah dengan perkataan Prabowo..
Yang saya simak adalah :
1. Tentang keyakinan  akan menang. 
2. Janji ttg program yg akan dilakukan setelah dilantik .

Lah, paslon yg kalah ( benarberdasarkan hitung cepat )
Menyatakan hal yg sama.

Anda berdoa agar tdk jadi dilantik..
Apakah Allah yg anda sembah beda dgn Allah yg disembah Prabowo ?
Kalau doa anda manjur, tentu paslon yg anda pilih menang..",1.0,
2024-03-02T13:05:47Z,@HabasiahSolona,Terlalu ambisi.,0.0,
2024-03-02T13:00:55Z,@babang_channell83, bangun lu jangan tidur mulu kebanyakan mimpi lu pe'a,0.0,
2024-03-02T12:59:38Z,@kelasX-12sman1cibadak,Yang komen rata rata pendukung anis yang katanya agamis.. tapi hatinya pada dengki,0.0,
2024-03-02T12:57:51Z,@linkanata2475,Kami terus dukung Pak Prabowo dan Mas Gibran,0.0,
2024-03-02T12:52:55Z,@adli365,"Yakin pak Prabowo jadi presiden atas ridlo Allah SWT, yg kalah jangan nangis dan banyak bacot, nggabung aja lah, legowo. Pak Mahfud MD yg Profesor juga dah legowo, udah menyebut dirinya mantan cawapres kok.",1.0,
2024-03-02T12:51:21Z,@pemburualam3071,PRESIDENKU BUKAN PRESIDEN YG CURANG.,4.0,
2024-03-02T12:49:16Z,@jokohermanto5043,Kelompok sakit hati makinramai,1.0,
2024-03-02T12:46:41Z,@WinSupeR-vw5xs,Kok bisa ya,0.0,
2024-03-02T12:46:32Z,@LaodeLaode-qo6zy,Mantap presiden ku,2.0,
2024-03-02T12:44:49Z,@kingpower960,SEHAT TRUS PAK PRABOWO SAMPAI MASA BAKTI 5 TAHUN. 😇🙏,1.0,
2024-03-02T12:43:00Z,@muhammadzen7752,Jangan terlalu Halu jendral 😅,0.0,
2024-03-02T12:38:18Z,@IbuMus-ei7uf,rakyat nya antri beras yg sedikit lebih murah bukan beras gratis,4.0,
2024-03-02T12:38:03Z,@adli365,"Curangnya dimana hayo , yang milih rakyat kok curang. Tetep yg jadi presiden itu Prabowo. Ramalan Gusdur akan terbukti ",0.0,
2024-03-02T12:25:02Z,@bangwan8457,#GakYakin,2.0,
2024-03-02T12:22:32Z,@aepsaeroji2912,"Mudah""han bukan omong doang,kalau hanya omong burung beo pun bisa.",1.0,
2024-03-02T12:18:11Z,@CLUMSY101,Yang pilih 02 emang semua otakny d lobang pantat. Lupa kalian sama kejadian tahun 98 🖕🖕🖕,0.0,
2024-03-02T12:17:55Z,@Ikanmujair11,"Gimana gak yakin😏kan dengan kecurangan yg udah berhasil dia perbuat itu lah, maka nya dia bisa SE yakin itu, bakal jadi presiden 2024 2029 nanti😏",2.0,
2024-03-02T12:14:02Z,@_Abu_Luqman,selama 5 tahun kita akan tertawa terus karena kelucuannya,8.0,
2024-03-02T12:13:24Z,@sitishabariyah2986,Kan.emang dari dulu dia.pingin.jd.presden,0.0,
2024-03-02T12:12:38Z,@sitishabariyah2986,"Ya lah ngaku aja
Ntar ga ditanggepin prabowo.ngamuk.lgi he heeh.hee",1.0,
2024-03-02T12:11:17Z,@onksadewoonk7041,Kerjaannya marah2😂😂😂,1.0,
2024-03-02T12:10:44Z,@StrangerAsing,Liat komentar disini kaya sarangnya orang berpenyakit hati..  kalah ya kalah aja,0.0,
2024-03-02T12:10:14Z,@user-wy4yl8hy7s,Haa ngimpi,1.0,
2024-03-02T12:10:03Z,@3bersaudarabersaudara520,Jangan sampai 2014 & 2019 terulang lagi pak😢,1.0,
2024-03-02T12:08:39Z,@seniviral_channel,Hormat pak.. Lanjutkan,4.0,
2024-03-02T11:52:46Z,@cireboncity4943,Ga ada malunya liat kecurangan di mana2 pak...belajar malu woyyyy,2.0,
2024-03-02T11:48:02Z,@user-wx4xl7vg6i,Atur aj dgn kecurangan km,0.0,
2024-03-02T11:37:21Z,@idonesiaidonesia8957,BPK Prabowo layak jadi pemimpin/presiden Republik Indonesia,6.0,
2024-05-26T03:47:08Z,@Jembut-pj1xh,Haduh ancur dah Indonesia ,1.0,
2024-05-18T15:12:03Z,@user-ms8bq1vr5x,"Nikmati lah 2 tahun anda pak presiden, Wakil nya Nanti yg akan naik. Kejadian jaman Ahok Jarot akan terulang",0.0,
2024-05-11T11:40:17Z,@user-el7ql5io1k,Ok untuk presiden tapi tidak untuk wakil presiden,1.0,
2024-05-11T11:39:03Z,@user-el7ql5io1k,Gibran tidak pantas jadi wakil presiden. Harus di ganti.,1.0,
2024-05-06T08:28:47Z,@Asmar00-zi2zu,Tidak akan maju rakyat jika menang nya menipu yg maju penipu rakyat makin banyak,0.0,
2024-05-03T19:19:22Z,@mohammadsahir8702,Prabowo Dan gibran cuma presiden Dan wapres pilihan kpu bawaslu Dan mk. Prabowo Dan gibran presiden Dan wapres Tidak sah.,0.0,
2024-04-30T17:04:40Z,@franskhadavi919,Bocah ingusan yg akan menjadi tertawaan sepanjang waktu,0.0,
2024-04-25T00:35:58Z,@realmeere6362,Alhamdulillah kami rakyat Indonesia selesai mengantarkan pak Prabowo ke kursi presiden kami rakyat Indonesia menantikan janji babpak utk menambah gaji guru 2juta rupiah per guru pak kami sangat mengharapkan itu.,0.0,
2024-04-23T12:17:10Z,@user-ru5eg1ed1m,Bila Mas Gibran menjadi presiden adalah presiden  termuda dari presiden di seluruh dunia.,0.0,
2024-04-22T19:02:33Z,@user-gz2uf2oi3h,tolong pa Prabowo Anis korupsi nanti kalo udah dilantik harus di usut,0.0,
2024-04-22T17:31:55Z,@Suprianto-xp3or,Bahagia bgt pilihan saya menang,0.0,
2024-04-22T09:29:53Z,@kintamani9365,"Pesanku Prabowo RI I, Gibran RR RI II,  jgn jadikan Menteri Anis dan Muhaimin itu saja, jika Ganjar dan Mahfud silahkan.",0.0,
2024-04-22T03:02:20Z,@kapidkapid5149,02 harus jadi pemimpin negara ini,0.0,
2024-04-22T03:01:36Z,@kapidkapid5149,Hidup 02,0.0,
2024-04-20T09:31:52Z,@ridwannefendi7611,Alhamdulillah pak prabowo presiden,0.0,
2024-04-20T05:11:45Z,@dedySyaputra-ep8ff,Kami bangga pak Perbowo menang merdeka,0.0,
2024-04-20T02:30:59Z,@EdiJunaedi-mk5ko,"Abai kan aja,pasangan yg ga siap nerima kekalahan nya.",0.0,
2024-04-18T05:14:14Z,@UdraKudratilah,"Jangan takut jangan diam,ayok 02 maju,anis dan refli kadrun suruh didepan ya,",0.0,
2024-04-16T10:32:35Z,@SingarajaSakti-gs5ws,"gasken ambil uang negara mumpung belum di ganti bro, buktikann bahwa kalian orang-orang yang durhaka dan melampaui batas",0.0,
2024-04-15T12:39:31Z,@maxmin-sv6mi,"Lantik pak Prabowo jadi presiden ,udh jelas2 menang, tunggu apa lagi,gak ush dipedulikan si Anies asing imigran arab yaman itu,mau koar2 curang mau atau mau ngebom sana sini mending usir aja dari Indonesia si Anies imigran asing itu dari Indonesia",0.0,
2024-04-09T04:54:42Z,@iwangipsun7223,Hah ga mau aku,0.0,
2024-04-08T13:58:39Z,@fftessa1855,Kami pendukung 02 mengucapkan selamat ya pa prabowo persiden kami yg baru ,2.0,
2024-04-07T09:34:54Z,@HerLena-nd1pu,Aku tak rela NKRI dipimpin oleh anis dn ganjar yg licik bnyk kerjasama dgn negara luar untuk menggagalkan prabowo jdi presiden sebab Amerika sangat takut prabowo jdi presiden disamping prabowo menguasai lima bahasa luar negri dia juga lulusan sekolah militer tersulit di luar negri,0.0,
2024-04-04T12:08:33Z,@Videografershot,"Sabar dan tabah pak prabowo , sampai saya sekarang berkhianat dari partai 03. Untuk memilih bapak , dengan ketulusan hati di injak 03, 01 juga tetap bapak tabah",0.0,
2024-03-28T17:43:43Z,@AzmiWibawa,"Selamat ya Pak Prabowo Subianto telah terpilih dan di pilih menjadi Presiden untuk memimpin bangsa ini
",5.0,
2024-03-25T07:04:32Z,@user-nr7jn2ob9r,RASA TIDAK PERCAYA AKU. KALO  BLIMBING SAYUR MENANG...BETULKAH INI,0.0,
2024-03-24T08:36:59Z,@gebyarnovita3233,"Mantap,, prabowo gibran menang Indonesia maju",0.0,
2024-03-23T12:40:07Z,@sammozaik1301,Jangan ikut undang2 jokowi prabowo biar aman negara,0.0,
2024-03-22T16:48:59Z,@AgusHamdani-rt8vy,semoga negara ini jauh lebih baik dari sebelumnya setelah bapak Prabowo resmi di lantik jadi presiden..,0.0,
2024-03-22T15:01:35Z,@AdhwaHanifah,@prabowo,0.0,
2024-03-22T15:00:36Z,@rosanovita2330,Bener2 satu putaran.. Rakyat kalo sudah berkehendak gak main2 😊,1.0,
2024-03-22T10:11:09Z,@rikmawan9622,Selamat ya pak saya senang melihat dan mendengarnya ,4.0,
2024-03-22T03:54:52Z,@farmchannel5646,Selamat pak.prabowo kami mendukungmu,0.0,
2024-03-21T15:52:29Z,@koosumadi7354,Alhamdulillah 02 menang 🎉🎉🎉 ✌️✌️,1.0,
2024-03-21T15:08:21Z,@septianade8210,"Tugas gibran hanyalah membubarkan para kadrun kadrun PDIP ,",0.0,
2024-03-21T04:13:22Z,@muhammadfakih-ju6xi,Alhamdulillah 02 menang,0.0,
2024-03-21T04:04:07Z,@Arjudani,"Selamat pak prabowo & Gibran raka buming raka, Menjadi presiden RI, periode 2024-2029,,,,,, SEMOGA AMANAH,,,, AMINNNN YRA,",3.0,
2024-03-21T03:37:33Z,@ristiatia3486,Selamat ya prabowo gibran,0.0,
2024-03-21T03:35:40Z,@khoiliibrahim4373,Dagelan pemilu yg memuakkan menghasilkan pemimpin yg cacat hukum dan gak sah !,4.0,
2024-03-21T03:27:17Z,@mashurputra3327,Kita tinggal tunggu makan siang gratis dan kenaikan gaji 2 juta selamat pak,1.0,
2024-03-21T03:20:12Z,@herywahyudi316,Selamat buat pak prabowo. Hati hati dengan wakil Bpk. Yaitu pak Gibran  akan. Menerkam bapak dari. Belakang untuk meneruskan. Cita cita Jokowi. Menjadikan negara indonesia menjadi negara dinasti,0.0,
2024-03-21T03:06:31Z,@user-kv8qr1ug6t,Selamat ya bpk prabowo subianto atas kemenangan bpk menjadi president RI 1 sehat sllu tuk membangun Indonesia emas ❤❤❤,8.0,
2024-03-21T02:53:58Z,@user-sm9ul5tl2c,BRAVO NKRI..PRABOWO GIBRAN PRESIDEN 2024 2029..,3.0,
2024-05-26T03:47:08Z,@Jembut-pj1xh,Haduh ancur dah Indonesia,1.0,
2024-04-25T02:43:18Z,@shelphobe380,"Gibran dilantik di penjara, prabowo di rumahkan diamankan sdh sepuh kasihan jadi wadal penguasa",0.0,
2024-04-25T02:42:27Z,@shelphobe380,Nanti di lantik setelah penguasa rezim tumbang di demo rakyat semesta,0.0,
2024-04-25T00:35:58Z,@realmeere6362,Alhamdulillah kami rakyat Indonesia selesai mengantarkan pak Prabowo ke kursi presiden kami rakyat Indonesia menantikan janji bapak utk menambah gaji guru 2juta rupiah per guru pak kami sangat mengharapkan itu.,0.0,
2024-04-23T12:17:10Z,@user-ru5eg1ed1m,Bila Mas Gibran menjadi presiden adalah presiden  termuda dari presiden di seluruh dunia.,0.0,
2024-04-22T19:02:33Z,@user-gz2uf2oi3h,tolong pa Prabowo Anis korupsi nanti kalo udah dilantikharus di usut,0.0,
2024-04-22T17:31:55Z,@Suprianto-xp3or,Bahagia bgt pilihan saya menang,0.0,
2024-04-22T09:29:53Z,@kintamani9365,"Pesanku Prabowo RI I, Gibran RR RI II,  jgn jadikan Menteri Anis dan Muhaimin itu saja, jika Ganjar dan Mahfud silahkan.",0.0,
2024-04-20T09:31:52Z,@ridwannefendi7611,Alhamdulillah pak prabowo presiden,0.0,
2024-04-20T05:11:45Z,@dedySyaputra-ep8ff,Kami bangga pak Prabowo menang merdeka,0.0,
2024-04-20T02:30:59Z,@EdiJunaedi-mk5ko,"Abai kan aja,pasangan yg ga siap nerima kekalahan nya.",0.0,
2024-04-08T13:58:39Z,@fftessa1855,Kami pendukung 02 mengucapkan selamat ya pa prabowo persiden kami yg baru ❤️❤️👍👍,2.0,
2024-03-28T17:50:39Z,@AzmiWibawa,Jgn sia2kan perjuangan bapak sampai tetes darah penghabisan saya akan tetap membela bapak,0.0,
2024-03-24T17:34:54Z,@zxxyzxxy4835,Yg kalah stres mikirin uang kampanye yg hilang😂,0.0,
2024-03-24T17:32:44Z,@rianbessing9609,"Berkat Rakyat jangan lpa Pak Jenderal dengan kami rakyat yg masih setia selalu mendukung bapak dari jaman era pak jokowi 2 periode.. Semoga Bapak menjadi pemimpin yg amanah, bijaksana, jujur dan sayang rakyat Indonesia🎉🎉🎉🎉yes paslon 02",0.0,
2024-03-24T08:36:59Z,@gebyarnovita3233,"Mantap,, prabowo gibran menang Indonesia maju",0.0,
2024-03-21T04:37:06Z,@ifayafriliano...8358,Ngimpi .,0.0,
2024-03-21T04:13:22Z,@muhammadfakih-ju6xi,Alhamdulillah 02 menang✌️✌️✌️✌️,0.0,
2024-03-21T03:06:31Z,@user-kv8qr1ug6t,Selamat ya bpk prabowo subianto atas kemenangan bpk menjadi president RI 1 sehat selalu tuk membangun Indonesia emas ❤❤❤,8.0,
2024-05-07T04:56:46Z,@abdulhalim5410,Beginilah konoha😂 lu punya duit lu berkuasa,0.0,
2024-05-02T16:44:25Z,@nastaimcs276,Alhamdulillah,0.0,
2024-05-02T03:07:06Z,@W_W_W_W_W_W_W_W_W_W_W_W_W_W_W,Saya yang merasakan kalau prabowo-gibran itu bener-bener kerja nyata,0.0,
2024-05-02T01:53:09Z,@RuangGaming9813,"jadilah lebih baik dari yang terbaik pak,semoga tetap amanah💪 sampai kapan pun",0.0,
2024-05-01T16:15:51Z,@lisnalisna4501,KEHANCURAN HUKUM DN NEGARA KETIKA PALU DN HUKUM BERADA DI MULUT ANJEENG..😂😂😂😂,0.0,
2024-04-30T10:33:14Z,@babebedhot9693,Jelas hitunganya pro pabowo tambah pro gibran jadi satu tambah yg dulu golput dan masyarakat luar pulau jawa semua prabowo,0.0,
2024-04-30T00:41:21Z,@user-yp3px3xp4i,ada yang kepanasan nih ada yang ngoceh ngoceh nih ada yang masih mau demo gak ya,0.0,
2024-04-29T03:50:54Z,@husnanarifin8074,"Selamat jendralku semoga masih di beri kesehatan umur panjang dan barokah , kami rakyat kecil menunggu bimbinganmu jendral",0.0,
2024-04-28T21:30:50Z,@nikomora-nu3sb,"selamat kepada bapak Prabowo dan Gibran atas kemenangan nya,smoga sukses slalu",0.0,
2024-04-28T19:49:11Z,@andhikanugraha33,Begitu humble nya pak prabowo ketika menyalami anis,0.0,
2024-04-28T10:17:22Z,@depiherdiansyah1158,hidup 02 prabowo gibran yg unggul di setiap tps seluruh indo,0.0,
2024-04-27T15:57:39Z,@user-de6hb9qp8l,"Semoga amanah & romantis sampai akhir masa jabatan pak prabowo, mas gibran..",0.0,
2024-04-27T12:47:31Z,@daviqrizal6455,Selamat pak Prabowo semoga indonesia tambah  maju adil makmur aman sentosa di pimpin pak Prabowo dan mas gibran semoga Allah meridhoi dan melindunginya dan pemimpin yg amanah ihklas untuk rakyat ,0.0,
2024-04-27T11:00:54Z,@annisaadistiani4157,"MasyaAllah alhamdulillah bapak akhirnya bapak menang 
bismillah semoga lancar ya mimpin negara ini sehat sehat pak dan mas gibran",0.0,
2024-04-27T03:50:39Z,@IyaLuu-tb1bh,Sehatkan lah selalu bapak Prabowo Subianto & Gibran 🤲,0.0,
2024-04-26T13:29:20Z,@user-nx4it6xd8o,Pengen nangis Prabowo pehlawan perjuangan,0.0,
2024-04-26T12:46:04Z,@user-sb1yy5oh8p,Anis ganjar menangis di selokan😅😅😅,0.0,
2024-04-26T07:10:49Z,@SarahSetiadarmaa,"Alhamdulillah pak Prabowo Gibran  menjadi pemimpin negri ini, semoga beliau bisa menjalankan amanah sebaik²nya",0.0,
2024-04-26T06:44:07Z,@haerudinmuhammadsyafei3019,"Tunggu...... Tunggu...... 1 tahun kedepan ada apa dengan Prabowo - Gibran,....... Nanti bisa dilihat..... Terpilihnya oleh siapa.......",0.0,
2024-04-26T05:40:15Z,@Brotoseno1922,Saatnya kembali pada habitat masing2.. yg kemaren gembar- gembor di bayar... Saiki podo bali dadi kuli... Wwkkkkkk,0.0,
2024-04-26T03:44:02Z,@biofloklinggauchannel,Alhamdulillah,0.0,
2024-04-26T00:18:20Z,@sukernosilva-ui2mr,"Ketua KPU taun depan harus di gantii yang lebih bagus,biar tidak terjadi kesalahan kesalahan fatalll yang menyita waktu",0.0,
2024-04-25T22:12:41Z,@RYNM011,mana anak abah dan ganjar dengar tuh yah yg di bilang tidak ada suara duhh jangan nangis yah 01-03🤣,0.0,
2024-04-25T19:14:28Z,@duse3419,Lihat pak Prabowo jadi inget pak Soeharto 🥲,0.0,
2024-04-25T13:45:04Z,@Rhusdiie,Yg bilang curang kaga terbukti curang 😂😂😂😂 berusaha melawan takdir.. Tidak menerima kekalahan,0.0,
2024-04-25T13:41:05Z,@cintakusatu3871,"Pak Prabowo sama mas Gibran pilihan Masyarakat dari sabang sampai meraoke,  dan sudah di Ridhoi Allah SWT Aamiin ",0.0,
2024-04-25T13:12:34Z,@fuad1686,ada yg berharap jadi mentri kek nya  setelah mejatuhkan menjelek2kan memfitnah lagi ,0.0,
2024-04-25T12:42:13Z,@cteamrecingspeed6865,Anak abah menangis,0.0,
2024-04-25T12:24:14Z,@taufikwfinance3630,Rambut putih afk,0.0,
2024-04-25T07:24:14Z,@husnulhatimah2536,menyala presidenkuuu Prabowo-Gibran .. semoga amanah,0.0,
2024-04-25T05:37:53Z,@escampurchanel807,"pilihan gw menang ,makasih yaaaa Allah",0.0,
2024-04-25T05:09:12Z,@CherryKopi-qr6bb,Alhamdulillah  bapak  dan wakil menang👍👍👍,0.0,
2024-04-25T01:52:36Z,@purniatipurniati8481,"Jangan lupa janji2 nya,",0.0,
2024-04-25T00:24:14Z,@Mamat_Ingusan,Gas pak Prabowo. Tugas pertama. Musnahkan KKB,0.0,
2024-04-24T22:56:18Z,@aksareynand2316,Alhamdulillah,0.0,
2024-04-24T22:30:45Z,@BuZain2014,Salam damai sejahtera selalu buat NKRI,0.0,
2024-04-24T20:32:25Z,@DUNIAMISTERI82,Alhamdulillah sudah selsai. Selamat buat bpak prabowo gibran . NKRI HARGA MATI,0.0,
2024-04-24T20:06:43Z,@megawati8840,Alhamdulillah smg barokah dan amanah Aamiin,0.0,
2024-04-24T17:39:34Z,@user-fi6lc6sw7n,Suara aku selalu untuk pak Prabowo,0.0,
2024-04-24T15:42:06Z,@zulfanzulfan5735,"Paman kasih bangku hargai usahanya, kasihan paman sampai di pecat.selamat bekerja ketua kpu, ketua Bawaslu dan ketua MK tetap di pertahankan,, beliau2 sangat amanah dan meraka adalah yg menentukan nasib bangsa dengan kejujuran nya di pilihlah Prabowo dan Gibran",0.0,
2024-04-24T15:06:55Z,@dedisutedijaya1307,Alhamdulilah semoga Indonesia menjadi negara yang baldatun toyibatun warobbun Ghofur Aamiin Ya Robb,0.0,
2024-04-24T14:42:29Z,@ChamdanUdin,"Alhamdulillah lelahku terbayar , selamat bapakku semoga Alloh meridloi dan membimbing bapak prabowo menjadi pemimpin yg amanah",4.0,
2024-04-24T14:30:47Z,@SaminemNganjuk,Meskipun prabowo gibran menang tetep aja akun rusmin gak Terima aja kalo junjungannya kalah kemarin saya lihat komunitas channelnya bikin judul rip demokrasi,0.0,
2024-04-24T13:48:52Z,@duldosen6189,Koyo ngene jd ketua KPU muda 2x han cepat modar lor .,0.0,
2024-04-24T13:02:43Z,@wajendraalresca7226,Semoga damai,0.0,
2024-04-24T12:53:16Z,@kangsantri8574,Semoga kedepan kebijakannya lebih mementingkan kita selaku rakyat kecil dari pada mereka yang berdasi,0.0,
2024-04-24T12:40:55Z,@dowvic412,"selamat bekerja untuk rakyat bapak prabowo, semoga amanah dan bisa membawa indonesia semaki  maju dan sejahtera🎉🎉🎉",0.0,
2024-04-24T11:36:42Z,@ventilissusanti3174,Bapak prabowo I love U,0.0,
2024-04-24T11:30:47Z,@user-sd7xu4mp1f,Alhamdulillah . Selamat menjalankan tugas pak prabowo dan mas gibran. Semoga Indonesia lebih baik dan maju aamiin❤❤,0.0,
2024-04-24T11:16:08Z,@nimrothtb,Selamat buat Mas Gibran Rakabuming Raka. Siapkan diri anda utk masa depan (next generation) Indonesia.,0.0,
2024-04-24T11:14:06Z,@nimrothtb,Selamat buat Pak Prabowo yg tdk pernah mundur dan tetap semangat untuk meraih yg terbaik buat Bangsa dan Negara.,0.0,
2024-04-24T11:12:28Z,@nimrothtb,"Selamat kepada KPU yg telah bekerja keras di atas kejujuran, netralitas, langsung dan bebas. Semoga Allah beserta KPU.",0.0,
2024-04-24T10:24:09Z,@widysucipto_2911,Alhamdulillah,1.0,
2024-04-24T09:56:01Z,@brokenswordmen,wkwkwkwk planga plongo modal bapaknya jadi pejabat!,0.0,
2024-04-24T09:45:48Z,@Al-Ikhlas159,Sah ❤❤❤,0.0,
2024-04-24T09:28:36Z,@widiriyasari8544,Selamat menjalankan tugasmu pak bowo dan mas e...tepati visi misi dan janjimu,0.0,
2024-04-24T08:39:25Z,@nendeyss,2024# pemilu dagelan,0.0,
2024-04-24T08:37:31Z,@RinaNadi,Semoga semua yg terlibat kecurangan  Pilpres 2024 baik2 saja,0.0,
